29Q326,CAMBRIA HEIGHTS ACADEMY,s,s,s,s
29Q492,"MATHEMATICS, SCIENCE RESEARCH AND TECHNOLOGY MAGNET HIGH SCHOOL",78,400,426,394
29Q494,"LAW, GOVERNMENT AND COMMUNITY SERVICE HIGH SCHOOL",52,385,377,377
29Q496,"BUSINESS, COMPUTER APPLICATIONS & ENTREPRENEURSHIP HIGH SCHOOL",49,379,414,359
29Q498,HUMANITIES & ARTS MAGNET HIGH SCHOOL,62,393,381,377
30Q286,"YOUNG WOMEN'S LEADERSHIP SCHOOL, ASTORIA",s,s,s,s
30Q301,ACADEMY FOR CAREERS IN TELEVISION AND FILM,98,410,440,405
30Q445,WILLIAM CULLEN BRYANT HIGH SCHOOL,395,414,449,412
30Q450,LONG ISLAND CITY HIGH SCHOOL,392,403,420,395
30Q501,FRANK SINATRA SCHOOL OF THE ARTS HIGH SCHOOL,174,504,496,494
30Q502,INFORMATION TECHNOLOGY HIGH SCHOOL,148,407,434,398
30Q555,NEWCOMERS HIGH SCHOOL,143,323,475,329
30Q575,ACADEMY OF AMERICAN STUDIES,135,487,492,491
30Q580,BACCALAUREATE SCHOOL FOR GLOBAL EDUCATION,61,524,568,544
31R047,CSI HIGH SCHOOL FOR INTERNATIONAL STUDIES,137,452,451,450
31R064,GAYNOR MCCOWN EXPEDITIONARY LEARNING SCHOOL,61,398,412,385
31R080,THE MICHAEL J. PETRIDES SCHOOL,107,472,488,466
31R440,NEW DORP HIGH SCHOOL,391,424,437,416
31R445,PORT RICHMOND HIGH SCHOOL,271,424,438,417
31R450,CURTIS HIGH SCHOOL,375,437,435,429
31R455,TOTTENVILLE HIGH SCHOOL,807,462,486,470
31R460,SUSAN E. WAGNER HIGH SCHOOL,535,455,474,459
31R470,CONCORD HIGH SCHOOL,10,466,455,414
31R600,RALPH R. MCKEE CAREER AND TECHNICAL EDUCATION HIGH SCHOOL,94,416,422,397
31R605,STATEN ISLAND TECHNICAL HIGH SCHOOL,227,635,682,636
31R607,YOUNG ADULT BOROUGH CENTER AT STATEN IS TECH HS,10,405,375,370
32K403,ACADEMY FOR ENVIRONMENTAL LEADERSHIP,50,380,366,352
32K545,EBC HIGH SCHOOL FOR PUBLIC SERVICE–BUSHWICK,88,384,409,361
32K549,BUSHWICK SCHOOL FOR SOCIAL JUSTICE,75,348,353,334
32K552,ACADEMY OF URBAN PLANNING,67,342,364,354
32K554,ALL CITY LEADERSHIP SECONDARY SCHOOL,39,428,465,422
32K556,BUSHWICK LEADERS HIGH SCHOOL FOR ACADEMIC EXCELLENCE,23,347,358,350
32K564,BUSHWICK COMMUNITY HIGH SCHOOL,24,359,317,358
75K371,P.S. 371 s LILLIAN L. RASHKIS,s,s,s,s
75M035,P.S. 035,s,s,s,s
75Q256,P.S. Q256,s,s,s,s
75Q811,P.S. Q811,32,429,444,433
75R025,SOUTH RICHMOND HIGH SCHOOL I.S./P.S. 25,s,s,s,s
75X012,P.S. X012 LEWIS AND CLARK SCHOOL,s,s,s,s
75X754,J. M. RAPPORT SCHOOL CAREER DEVELOPMENT,s,s,s,s
79M645,SCHOOL FOR COOPERATIVE TECHNICAL EDUCATION,s,s,s,s
79Q950,GED PLUS s CITYWIDE,8,496,400,426
79X490,PHOENIX ACADEMY,9,367,370,360
