2014-05-09T06:45:36Z,76,plosworkshop.org,The Lurking Smalltalk in Unix and Plan 9 [pdf]
2013-10-23T00:05:16Z,2,1.usa.gov,Save the United States' economy 
2010-11-12T07:19:29Z,1,trickswindow.com,Wordpress SEO Plugins | Tricks Window
2008-09-06T15:49:55Z,1,downloadweedsepisodes.sampasite.com,Download Weeds Episodes
2008-05-14T12:35:55Z,1,seroundtable.com,att Cutts Discusses Google's Knowledge of Spam
2011-06-15T11:26:34Z,1,youtube.com,SM Julian Assange Hit Piece pt.1
2012-02-24T15:24:02Z,1,tmblr.co,The ZBOARD Could Actually Make Powered Skateboards Go Mainstream For The Masses
2015-03-21T19:05:24.000Z,1,techcrunch.com,Windows 10 Confirmed for This Summer
2009-01-30T17:34:11Z,46,groups.google.com,Ruby 1.9.1 Released: First Stable Ruby 1.9 Release
2013-03-07T12:11:22Z,1,orkia.fi,Orkia.fi is a finance company and we are hiring
2011-10-14T23:45:46Z,1,applecasts.com,Fantastical: A Fun Way to Manage Your Calendar
2012-06-17T21:19:50Z,19,"",Ask HN: How do you make sure a B&B has wifi in the room?
2012-07-16T17:07:28Z,5,blogs.hbr.org,How to Manage Your Smartest Strangest Employee
2009-06-04T03:16:56Z,1,linux-mag.com,KDE 4: The Komplete Desktop?
2014-04-07T18:03:54Z,1,correlatedcausation.com,Flywheel – 8 ways to build marketplace liquidity
2012-06-03T10:22:41Z,2,arstechnica.com,On Chinas Twitter telling lies will get you kicked out
2012-04-27T19:12:59Z,2,"",Ask HN: How much do I cost to Facebook?
2011-10-04T19:19:12Z,10,"",Whois on apple.com paypal.com amazon.com bing.com spam
2012-11-20T19:28:14Z,1,dailydot.com,How art history is failing at the internet
2015-02-14T20:04:43.000Z,3,itunes.apple.com,Binary – The game // My first iOS game. Feedback is welcome
2011-01-05T21:09:13Z,1,realtea.net,The History of Selling Personal Data
2013-08-15T06:43:41Z,2,youtube.com,The People Smuggler Experiment 
2011-10-02T20:13:32Z,1,readwriteweb.com,OpenStack Leader: Open Source Needs to Rethink Its Priorities
2012-01-27T17:57:37Z,1,thenextweb.com,How to get around Twitter restrictions
2015-03-02T17:45:00.000Z,5,arstechnica.com,Supreme Court gives tacit approval for government to take anybody’s DNA
2010-11-12T04:45:26Z,1,click4newz.com,Karachi: Powerful Explosion CID office 18 killed
2015-02-03T11:24:11.000Z,2,dotomator.com,Use Dot-o-mator to create domain name suggestions
2014-12-19T07:14:19.000Z,9,dbittman.github.io,Fighting with Your Compiler
2012-08-20T01:19:29Z,68,notes.unwieldy.net,The Future is not Real-Time
2009-03-20T14:47:19Z,6,research.microsoft.com,Reverse Engineering the Twelve Days of Christmas
2014-01-15T03:32:20Z,2,stratechery.com,Apple and the innovator's dilemma [2010]
2011-07-21T23:27:57Z,2,swipegood.com,SwipeGood Raising $8500 to Build School in Kenya (YC Startup)
2013-11-21T10:32:01Z,6,"",Ask HN: Would the web be a better place with a CLR or JVM in the browser?
2013-02-25T22:57:17Z,5,torrentfreak.com,The Pirate Bay Departs Sweden And Sets Sail For Norway and Spain
2012-03-23T14:05:52Z,1,news.cnet.com,Why Facebook works people far too hard
2010-09-27T04:44:45Z,1,heidi-miller.com,Robots are better tweeters than you are
2011-03-06T22:57:33Z,2,jamesaltucher.com,Unusual Ways to Love Ourselves
2014-02-17T22:17:28Z,3,github.com,Linux Sysadmin/Devop interview questions – Please contribute
2013-09-22T02:22:29Z,4,bost.ocks.org,D3 Workshop
2009-12-23T18:55:28Z,3,henrysztul.info,Non Constant Speed of light
2014-05-02T14:29:02Z,1,arxiv.org,Deep learning in neural networks: An overview
2010-07-30T10:58:11Z,2,blog.harmonypark.net,Do you use Skype? Here's a new emotie hack pack for you to use
2013-05-09T10:19:13Z,1,coachbagshot.com,Coach OutletCoach Factory OutletCoach Outlet Store
2011-03-07T04:43:05Z,1,almstba.com,"    |    "
2014-07-29T21:46:41.000Z,2,pcmag.com,Deconstructing Corporate Culture to Find Microsoft's Soul
2014-02-20T13:05:16Z,7,redbull.com,Is this wireless Oculus Rift rival the next big thing?
2012-01-27T22:11:28Z,1,jalopnik.com,How Apple Bought Saab's Mapping Software
2014-01-31T08:50:57Z,2,technologyreview.com,Android App Warns When You’re Being Watched
2013-02-28T09:14:32Z,2,nominet.org.uk,Nominet not proceeding (yet) with offering second-level .uk domain names
2013-11-15T18:56:11Z,1,alhqeqa.com,"            "
2011-05-15T17:09:21Z,53,journal.uggedal.com,Deploying Python WSGI applications with Puppet
2014-02-25T02:08:37Z,2,two-bit-idiot.tumblr.com,Bitcoin’s Apocalyptic Moment: Mt. Gox may have lost 750000 bitcoins
2014-09-04T22:08:25.000Z,5,adbusters.org,DATAcide – The Total Annihilation of Life as We Know It
2011-12-24T19:05:22Z,1,scanii.com,An API for virus scan
2013-04-12T17:06:18Z,2,blog.neverfold.com,Listening to feedback
2010-04-09T13:36:22Z,1,nileguide.com,Holy Body Parts 7 Saintly Relics Around the World 
2013-05-06T08:15:29Z,10,moot.it,oot v1.2: SEO 14 languages image posting
2010-10-20T20:45:03Z,1,xprogramming.com,MF? Minimum is smaller than you think
2011-11-13T07:43:10Z,1,rentuntilyouown.com,Rent to own contracts
2012-01-23T21:23:14Z,78,hacks.mozilla.org,JavaScript on the server: Growing the Node.js Community
2013-12-13T01:39:11Z,1,en.wikipedia.org,iller-Urey experiment
2012-01-12T21:44:26Z,1,propublica.org,New Bill Would Put Taxpayer-Funded Science Behind Pay Walls 
2012-09-03T23:51:28Z,1,idahospuds.blogspot.com,Getting Started with HaxeFlixel: Port of the Flixel 2D Gaming Engine
2012-02-03T19:22:50Z,2,nytimes.com,He's not really paying 102%. It's really 20%
2014-03-03T15:46:59Z,2,medium.com,Death To The Demo Day
2008-10-07T09:28:10Z,2,cbsnews.com,As Lehman collapsed Execs were rewarded
2013-12-02T15:04:20Z,117,"",Why I am no longer submitting direct URLs to HN (and neither should you)
2011-10-29T14:00:29Z,1,curesfromearth.com,Testing of Automotive Non-metal Materials
2013-08-22T10:08:22Z,11,code.google.com,y manager says your buttons are too small
2012-12-22T03:58:39Z,1,battery-cheap.co.uk,FUJITSU SQU-808-F02 Laptop Battery Pack
2013-05-30T18:09:38Z,1,github.com,emory profiler for Ruby on Rails
2011-06-29T14:01:19Z,151,37signals.com,Wizards of bullshit: How Forbes turned $6.5 million into $20 billion
2013-01-31T12:08:08Z,2,coderwall.com,~~ is faster than Math.floor() in JavaScript
2013-09-10T05:09:07Z,12,blog.udacity.com,Announcing the launch of the Open Education Alliance
2013-09-23T19:08:27Z,1,forteanzoology.blogspot.co.uk,"UK filter to block ""esoteric content"""
2010-09-12T21:40:42Z,15,thestar.com,Lack of vitamin D possible cause of schizophrenia
2013-05-20T07:32:03Z,144,leebrimelow.com,Native equivalents of jQuery functions
2012-02-07T17:44:14Z,1,yourstory.in,Twitter accounts activity for top 20 countries 
2013-05-30T20:44:45Z,2,stratechery.com,Why TV has resisted disruption
2010-02-19T19:11:21Z,1,techsansar.com,Disable IFrames in Internet Explorer
2010-12-15T09:02:24Z,2,slaven.posterous.com,Why I Don't Want a Windows iPad
2014-08-15T13:10:56.000Z,4,themukt.com,64-bit mobile processors for Android L is coming
2012-03-08T04:44:04Z,1,swithu.com,Sharing made easy - No account required content sharing site
2014-03-24T16:38:06Z,1,scala-js-fiddle.com,Scala-Js-Fiddle
2013-03-14T16:14:46Z,2,gov.uk,Government Service Design Manual
2011-01-12T18:59:09Z,1,victusspiritus.com,End the hoard mentality
2012-12-28T06:04:11Z,6,hackerschool.com,"What we mean when we say ""hacker"""
2012-03-15T15:46:22Z,1,venturefizz.com,Wayfair - Office Tour [slideshow]
2014-08-07T17:50:01.000Z,4,developers.google.com,Google Fit SDK preview available
2011-11-28T23:11:57Z,1,popsciencebooks.com,Top 5 of popular science books on biology in 2011
2011-08-23T04:37:57Z,1,screenrecord.net,Capture Pictures from Video
2011-07-27T16:11:45Z,1,money.cnn.com,Betting $4.8 billion on a U.S. default
2011-11-01T11:46:03Z,402,.whitehouse.gov,Stop the E-Parasite Act
2011-07-01T07:01:21Z,2,mothereffingcssescapes.com,How to escape any character in CSS
2009-05-17T03:14:31Z,1,listown.com,What time does the preakness start 2009
2011-03-21T20:24:45Z,2,busmapper.co.uk,Find London Buses Quickly and Easily | BusMapper.co.uk
2012-03-21T14:18:08Z,1,imediaconnection.com,What's missing from HTML5 
2013-03-29T23:17:16Z,219,davidgelphman.wordpress.com,Two Letters from Steve Jobs
2010-11-18T18:13:33Z,1,phoronix.com,Benchmarks Of Debian EtchLenny and Squeeze
2012-03-24T06:37:57Z,1,blogs.wsj.com,With OMGPOP Patience Paid Off Says Sparks Bijan Sabet
2014-02-28T16:32:04Z,1,npr.org,UK Spies Intercept Webcam Pics
2010-02-16T14:22:02Z,1,greaterdebater.com,When is a debate won?
2012-01-28T22:51:35Z,1,businessinsider.com,Ekranoplane; part plane part boat and part hovercraft
2007-03-08T20:12:42Z,3,radar.oreilly.com,O'Reilly Radar: Jedi build their own lightsabers
2015-02-11T03:36:53.000Z,2,zdnet.com,yCoin closes its doors $387M in investor funds vanishes
2013-10-28T13:50:02Z,1,anthonypompliano.com,The Most Compelling Reason To Question Everything
2011-04-22T05:37:42Z,11,"",Ask HN: Do you have a responsibility to tell a client they are wasting money?
2013-05-23T14:12:26Z,1,arb-liga.com,"      "
2014-06-19T13:39:33.000Z,1,nytimes.com,Should Restaurant Reservations Be for Sale?
2008-10-30T02:55:50Z,2,"","Ask HN: Good reading material for ""mobile"" stuff?"
2013-09-23T06:11:14Z,1,phys.org,Kitchen gadgets powered by microwave leaks
2014-03-19T23:25:34Z,1,lavinski.me,What's in a buzzword
2014-10-31T09:02:39.000Z,4,nodesource.com,Non-Technical Impressions of Node.js
2011-04-15T10:25:09Z,1,startupgreece.gov.gr,Greece tries to start up
2009-03-28T13:34:54Z,4,blog.linkedin.com,The CEO of Moo.com blogs about the art of business cards
2013-03-25T14:56:20Z,1,worldofcardgames.com,Cool multiplayer card game website
2012-03-02T02:54:00Z,10,businessweek.com,How Three Germans Are Cloning the Web
2013-12-03T03:56:47Z,2,ngm.nationalgeographic.com,The Changing Face of America
2013-02-12T20:50:52Z,1,webnethosting.net,Top Recommended and Must Have WordPress Plugins
2011-11-05T01:25:49Z,1,xn--y8j7dzbj4za8abf6b.net,news
2010-01-05T15:26:22Z,3,"",Ask HN: please review my project (just a demo for now)
2013-10-04T10:22:23Z,1,latimes.com,Swarms of hornets kill 42 people injure hundreds in northwest China
2012-07-18T17:34:05Z,4,inside.godaddy.com,Go Daddy acquires Outright.com
2012-11-21T12:21:11Z,1,news.techworld.com,24-hour Raspberry Pi hackathon competition set for December
2010-01-14T03:25:30Z,12,fabiensanglard.net,Doom 1993 code review
2010-10-21T20:46:04Z,64,theglobeandmail.com,"Calgary's new mayor: ""Politics in full sentences"""
2014-02-06T04:36:23Z,1,github.com,Alternative workflow for AngularJS development
2011-09-13T02:27:50Z,1,cieasia.org,ake your own Family Business
2014-04-09T02:57:36Z,2,airpooler.com,Airpooler
2014-04-02T20:27:48Z,1,allaroundtheworld.fr,Refactoring legacy code bases
2012-02-18T21:54:02Z,1,"",Skrittle - A New way to find websites
2010-01-02T17:47:55Z,160,diveintohtml5.org,A Form of Madness - Dive Into HTML5
2011-03-04T12:18:22Z,138,structuredprocrastination.com,Procrastination and Perfectionism
2014-06-19T19:28:54.000Z,2,science.raphael.poss.name,Haskell for OCaml programmers
2011-08-24T09:42:10Z,1,evilmadscientist.com,icrowave Oven Diagnostics with Indian Snack Food
2012-07-10T12:23:43Z,1,fatbit.com,Why Hire Dedicated  Programmers Instead of Freelancers
2013-09-04T13:47:27Z,1,alexpcoleman.com,What other consultants do wrong
2012-03-23T00:04:59Z,1,arstechnica.com,icrosoft brings Git support to its CodePlex hosting service
2011-02-22T08:50:25Z,1,pedroassuncao.com,Dropbox plus Mercurial -driven development. Anyone tried that?
2010-11-24T19:24:53Z,3,wholehealthsource.blogspot.com,Glucose Tolerance in Non-industrial Cultures 
2013-09-26T00:07:43Z,1,on3dprinting.com,ake a Caffeine Necklace With Mixee Lab's 3D Printed Molecule Jewelry
2014-03-22T21:28:12Z,2,turbosquid.com,Super-real 3D model of a male head
2014-03-05T04:02:29Z,2,pando.com,Apple's Tim Cook and His Dilemma over Sustainability and Climate Change
2011-07-27T17:21:09Z,1,startupweek2011.at,First European Startup Festival 
2011-11-10T16:06:25Z,2,peerbind.com,Show HN: Peerbind - Shared drawing in 35 lines of code. 
2008-03-14T16:14:11Z,22,securecoding.cert.org,Top 10 Secure Coding Practices
2009-04-23T15:17:09Z,1,lancemannion.typepad.com,The difference between in loco parentis and loco school principals
2014-05-14T03:44:13Z,1,techtalkshub.com,JIT Compiler For The Erlang VM
2013-02-24T22:14:04Z,4,blog.tankorsmash.com,How to use Imgur's new API3 with OAuth2
2013-11-08T03:39:41Z,1,youtube.com,$100 audio controlled and governed photolithographic 3D printer [video]
2009-05-06T12:33:11Z,1,webwindows.co.uk,Webwindows | Sample Pages | The Times | The Sunday Times | The Independent | The Observer
2012-11-27T12:04:48Z,1,akhbarak2012.blogspot.com,"       "
2013-09-19T03:21:05Z,2,oocities.org,Oocities.
2014-08-26T14:36:31.000Z,1,pastors.com,You Can Have Growth or You Can Have Control
2008-08-18T19:01:01Z,1,uie.com,The Long Wow
2013-04-08T14:42:41Z,6,"",Ask HN: Which startup is crushing it
2008-04-04T16:26:22Z,6,monad.me.uk,A lambda calculus for real analysis
2011-05-08T14:20:01Z,14,usingimho.wordpress.com,What's so special about Apple products?
2012-04-06T17:28:03Z,1,geek.com,Toray's touchscreen film self-repairs a scratch in 10 seconds
2013-04-17T15:01:57Z,1,cloudtweaks.com,If 20 Famous Movie Quotes Were About Cloud Computing
2011-01-05T10:30:44Z,1,jhollingworth.com,Web automation using Cucumber + Capybara
2012-05-17T22:37:44Z,13,words.alexeypro.com,Got my app out of the door with RubyMotion in just 2-3 hours
2013-02-14T18:46:48Z,1,nexenta.com,ZFS for Dummies
2013-03-06T14:03:24Z,2,github.com,Show HN: Tiny script to make links possible for all html elements
2008-11-25T13:43:30Z,1,ajaxian.com,Car Navigation Map Mashup in Canvas
2012-08-21T12:39:59Z,5,"",Ask HN: Are there any segmented HackerNews?
2012-06-21T11:38:50Z,1,techcrunch.com,Office On The iPad App Raises $16M Is Adding Group Collaboration
2008-09-23T15:54:41Z,3,"",So I started to twitter who should I follow?
2013-10-03T12:08:18Z,4,joshuaspodek.com,How I got my web page redesigned at no cost and made a friend in the process
2011-01-04T20:04:38Z,1,chrisyeh.blogspot.com,Support Don't Envy Your Fellow Entrepreneurs 
2012-01-24T06:19:44Z,1,alearningaday.com,In my Gut
2013-07-31T09:00:56Z,1,latimes.com,Proposal would let ride-sharing firms operate in California
2011-11-05T09:23:51Z,1,srebro-zlato.com,Popolno okolje za rast cene zlata
2013-04-18T01:17:35Z,3,medium.com,Akka - The most important middleware you've never heard of.
2008-03-24T22:32:48Z,15,mirror.facebook.com,Facebook Mirror | Index of /
2011-09-11T09:46:01Z,1,medacity.com,9/11 and the Rise of New Media
2011-09-29T23:35:06Z,1,codingthriller.blogspot.com,The iPad Information Diet
2008-07-06T05:31:49Z,1,bikinipleasure.blogspot.com,icro Bikini Pleasure: Bikini Celebrity Cruise : Yurizan Beltran
2013-02-09T18:20:47Z,1,photospots.dk,Canon 600D/T3i vs Canon 60D: What to buy?
2014-04-15T21:33:39Z,1,github.com,"JavaScript OOP ""Done Right"""
2011-01-10T11:04:42Z,1,specialimages.co.uk,Executive Portraits
2010-01-14T18:11:01Z,7,"",Ask HN:  How to best handle accusation of plagiarism/copyright?
2011-10-13T23:24:55Z,2,backbonetutorials.com,Backbone.js - Organizing your application using Modules (require.js)
2014-12-07T10:01:31.000Z,1,youtify.com,Youtify is no more
2014-07-21T06:42:01.000Z,4,q-track.com,Do Radio Waves Bounce Off Each Other?
2008-11-28T22:42:18Z,15,"",If Silverlight were installed just as often as Flash would you use it over Flash?
2011-12-17T12:33:41Z,2,dailymail.co.uk,illions of people watch awesome video game move
2015-03-25T14:09:56.000Z,1,blog.weekdone.com,Best Practices of OKR's – Objectives and Key Results. Examples and Templates
2012-01-07T10:13:51Z,1,theorthodoxchurch.info,Submit a News
2007-08-04T22:52:23Z,1,news.yahoo.com,Self-service economy arrives slowly but potential barely scratched
2014-12-13T06:35:31.000Z,2,github.com,emacs-refactor: A refactoring system for Emacs
2011-11-23T05:57:50Z,3,google.com,Google's Thanksgiving Doodle
2011-03-28T02:57:04Z,11,comicsalliance.com,'Dilbert' Creator Scott Adams Criticized for Gender Equality Article
2013-06-03T07:38:50Z,2,slideshare.net,Internet Trends 2013 By KPCB
2012-07-19T01:20:53Z,2,"",Bitbucket is down 2012-07-17
2010-09-14T06:38:13Z,4,telegraph.co.uk,Flip-thinking: the new buzz word sweeping the US - Telegraph
2012-11-22T15:41:49Z,1,zaptap.com,5 Key Players Already Onboard with NFC Technology
2009-05-14T20:38:03Z,1,fluxicon.com,Breed better software
2014-02-21T21:02:39Z,1,otter.mutualmobile.com,Show HN: iOS App Review Visualizer (Otter)
2010-11-19T15:29:10Z,2,dailymail.co.uk,'Spastic' Transformer: Reasons to research product names before launching
2009-03-09T16:45:56Z,1,hiscatalog.com,His Catalog Announcement: Traffic Doubled New Features
2011-08-01T17:51:36Z,8,singularityhub.com,Take A Look Inside The Video Spy Glasses That Conquered Kickstarter
2012-02-06T04:03:18Z,4,blog.areyoupayingattention.com,The Open Web Is Dead  Long live the Open Web
2010-04-29T19:07:46Z,11,joncarder.com,Game Mechanics - the new black
2013-08-26T16:07:42Z,18,gamasutra.com,Our most successful game is also our least profitable
2010-08-20T15:57:59Z,1,"",Storing semi-confidential data
2013-10-29T00:25:57Z,1,portent.com,Baby Jesus as a marketing testimonial. Seriously.
2009-06-22T21:18:16Z,2,cis.upenn.edu,The Penn-Lehman Automated Trading Project (2005-06)
2008-12-30T03:59:04Z,18,macrabbit.com,Espresso Public Beta Released - Textmate finally gets some competition
2014-12-01T10:46:08.000Z,2,techcrunch.com,These Cool Robots Are Processing Your Amazon Orders
2013-05-06T15:12:51Z,5,blog.palominolabs.com,Ruby Testing and External Dependencies
2014-12-10T20:31:07.000Z,14,hackprofiler.alizee.io,Show HN: A Hacker Profiler to find teammates for hackathons
2012-06-11T17:08:06Z,2,zerotocoder.com,Zero to Coder - Phase Zero. Installing Ruby on Rails.
2013-09-16T20:19:29Z,2,cbc.ca,Surveillance a condition of Canadian wireless licence
2013-05-02T17:30:02Z,1,reddit.com,No-Hype Bitcoin Subreddit
2012-10-12T21:45:35Z,1,ideas.time.com,What Is Your Dog Thinking? A Lot
2011-04-23T07:05:32Z,1,alexlevinson.wordpress.com,3 New Thoughts on Mobile Location  A Follow up to Apple Location Tracking
2012-06-25T19:42:22Z,1,linkthing.co,Show HN: A work-in-progress Bookmarking manager built on Twitter
2011-09-05T05:29:03Z,1,livetv.pk,Watch Geo Super Live free online
2008-10-21T08:11:22Z,2,capttofu.livejournal.com,ySQL multi-master replication
2014-07-03T19:47:58.000Z,4,piconka.com?release=2,Show HN: Another way to bookmark
2010-08-29T21:19:28Z,2,techcrunch.com,How To Launch In 10 Steps With Less Than $2000
2009-05-11T13:01:26Z,1,socialium.com,Social Media Application
2014-02-14T15:52:10Z,1,sdtimes.com,A Valentine’s Day guide to targeting for mobile app developers
2012-06-27T21:20:42Z,2,pandodaily.com,Chill Heats up with $8 Million in Funding and a TMZ Content Partnership
2012-12-30T15:39:52Z,4,techcrunch.com,Foursquare To Start Using Full Names Sharing More Of Your Data With Venues
2009-03-24T21:11:03Z,33,sfgate.com,Low-income students feel left out at Stanford
2011-11-14T10:06:36Z,1,lowtechmagazine.com,Gas Bag Vehicles
2012-09-18T20:40:45Z,6,336699.org,Localization is a requirement heres a guide
2011-08-27T19:33:19Z,92,floatinguniversity.com,Introducing The Floating University
2012-10-03T15:35:25Z,1,varely.com,y Ascension To Programmer
2014-04-25T11:32:20Z,1,onetrueerror.com,OneTrueError – Automated exception handling in .NET
2011-03-27T16:05:32Z,1,instrumentalmusicdownloads.org,Instrumental music downloads - hints and tips
2010-10-17T22:42:29Z,1,solarfeeds.com,Dude Marijuana as an Alternative Fuel?
2015-03-16T12:51:36.000Z,1,runarberg.github.io,Show HN: Ascii2MathML – Easily turn AsciiMath into MathML
2012-10-02T18:39:41Z,1,loopfuse.com,What you need to know about Google Tag Manager
2009-04-01T21:40:24Z,1,readwriteweb.com,Ebay Launches Selling Manager Applications Beta
2013-12-23T21:40:17Z,1,nber.org,Is Bitcoin a Real Currency? [Natural Bureau of Economic Research]
2010-11-23T19:43:14Z,2,sizzlelanguage.blogspot.com,"How Sizzle says ""Hello World"""
2013-11-05T12:01:13Z,2,guru8.net,Is Helpouts by Google relevant to Africa
2012-03-09T17:00:35Z,1,macrumors.com,Apple Investing $300 Million in Austin Texas to Add 3600 More Workers
2013-11-04T14:04:02Z,1,medium.com,The Dublin Web Summit or How We Destroy Everything
2011-10-31T05:51:27Z,86,blog.echen.me,Stuff Harvard people Like
2011-10-06T11:20:51Z,73,andrewwilkinson.wordpress.com,Beating Google With CouchDB Celery and Whoosh (Part 1)
2011-09-23T01:29:33Z,2,delimiter.com.au,Jellemas ZeroMail wins Citrix funding
2012-03-21T19:51:04Z,3,"",Ask HN: Where's your overnight business/app/framework today?
2013-09-30T13:39:10Z,1,online.wsj.com,Startups look for workers who want to launch startups themselves
2009-02-12T15:53:02Z,2,wired.com,CSI Scandinavia: Computer Dissects Cadavers With No Scalpel 
2012-10-12T13:20:18Z,1,jotform.com,JotForm + Stripe = Beautiful Payment Forms in Minutes
2011-02-07T19:24:00Z,3,reddit.com,Gizmodo's complete redesign: A textbook example of how not to do it.
2011-08-03T06:59:42Z,1,bestledtube.com,LED T5 Tube
2011-11-18T12:03:53Z,3,news.com.au,Amazon to launch smart phone
2011-12-06T20:29:49Z,1,memegenerator.net,Clueless Founder
2013-06-18T19:29:10Z,2,eweek.com,Tech Companies Don't Tell Whole Truth About Data They Send to Feds
2012-05-31T09:32:57Z,1,autorepairatlantaga.net,Auto Repair Atlanta
2011-05-13T14:15:08Z,2,blog.jprosevear.org,ozilla employee on WebGL & Security
2008-03-07T18:28:30Z,3,advice.cio.com,Why the iPhone's Still Not Ready for Business...No Matter What Apple Says
2015-04-08T19:22:54.000Z,4,venturebeat.com,Watch Google's latest deep-learning system recognize sports in YouTube clips
2012-08-13T16:17:01Z,2,antimatter15.com,Swipe Gesture for Chrome
2014-04-16T19:34:14Z,1,medium.com,Cognitive biases keep you clicking on Top lists
2013-08-05T08:38:51Z,4,code.shutterstock.com,Rickshaw is a JavaScript toolkit for creating interactive time series graphs
2014-04-29T13:57:15Z,1,msujaws.wordpress.com,Customization in the new Firefox
2014-03-19T14:46:49Z,2,reddit.com,agnus Carlsen IAmA: #1 Chess Player in the World
2010-05-21T14:58:04Z,32,"",Show HN: didtheywinornot.com Single Purpose Scores Site
2013-08-07T14:04:25Z,1,onetius.com,[for students] Making college easier with help of students across the Earth
2010-11-30T00:37:53Z,2,startmate.com.au,Startmate applications close very soon (Australian seed stage fund)
2011-04-06T06:52:47Z,1,tsimpountiii.gr,Funny Pics
2009-06-24T07:47:43Z,1,1stop4femaleorgasms.com,Orgasmic Hot Spots
2012-05-10T14:59:19Z,2,bch.me,The Myth of A Players
2015-01-29T19:55:46.000Z,3,ericzhang.me,Gas Station ATGs Exposed to Public
2011-05-31T10:40:13Z,1,delhi-escortsservice.com,Cheap and Busty Female services Delhi +91-9582890405
2012-03-23T13:21:14Z,1,primarycoffee.com,Use your iPad as coffee warming pad
2011-01-27T17:20:40Z,3,cloudsigma.com,Jclouds & libcloud add support for the CloudSigma public IaaS cloud
2011-09-22T10:09:16Z,1,voucherking.co.uk,Thomas Cook voucher codes
2013-06-13T22:43:02Z,2,googleenterprise.blogspot.ca,Retiring Google Chrome Frame
2012-12-19T14:15:56Z,1,demandaplan.org,Demand a Plan to End Gun Violence
2011-04-27T04:23:37Z,1,apps.facebook.com,y first Facebook application. Social Spreader.
2014-07-16T05:54:58.000Z,1,techcrunch.com,There’s No Crying In Inside Baseball
2014-10-13T18:15:20.000Z,2,nytimes.com,Contents of Time Capsule Long Forgotten Are Less Than Memorable
2012-04-18T07:41:52Z,1,sneakerwin2012.com,Nike Free Run Shoes
2008-05-27T23:41:23Z,1,techcrunch.com,Paglo Launches Its Search Engine for IT
2011-03-11T23:03:16Z,1,gawker.com,Gawker's take on what's your e-mail address says about you
2011-10-23T22:41:25Z,1,hitch.me,Show HN: Professional Dating Site
2013-03-01T17:38:52Z,17,bostonglobe.com,Harvard Square businesses install tablets to collect for homeless
2011-08-07T19:15:09Z,1,dailymail.co.uk,Thousands of Verizon workers up and down east coast go on strike
2014-03-10T20:33:48Z,2,en.wikipedia.org,The Ship of Theseus
2010-05-19T02:42:12Z,2,asylum.com,"  Will Bonetown be a hit?"
2010-11-16T19:57:07Z,2,wolfram.com,What's New in Mathematica 8
2012-06-06T22:38:34Z,1,techcrunch.com,Indiegogo Raises $15M To Make Crowdfunding Go Mainstream
2013-05-14T21:00:28Z,2,finovate.com,The Biggest Innovations in FinTech - Conference
2013-11-27T14:58:40Z,4,bbc.co.uk,NSA 'planned to discredit radicals over web-porn use'
2012-02-24T08:57:56Z,1,knol.google.com,Waste Toner Cartridges Create Harmful Impact On Your Health
2010-10-15T19:46:49Z,1,theoatmeal.com,Why working from home is both awesome and horrible
2011-04-01T21:36:36Z,1,youtube.com,Being a Google Autocompleter
2011-01-06T19:43:43Z,3,utkarshsengar.com,ultiple Linux Users on 1 Amazon EC2 Instance
2010-10-16T22:33:10Z,1,nytimes.com,Defying Predictions Miners Kept Healthy (Thanks to Rescue Diet)
2013-10-02T03:37:13Z,1,techcrunch.com,Three Top Microsoft Investors Allegedly Want Bill Gates To Step Down As Chairman
2014-08-13T16:41:59.000Z,1,"",Ask HN: Know any female CEOs taking companies public
2012-07-02T20:02:10Z,1,twitter-doghouse.herokuapp.com,Tired of people shitting all over your tweet stream? Try doghouse.
2012-01-09T13:07:57Z,2,arstechnica.com,Part virus part botnet spreading fast: Ramnit moves past Facebook passwords
2011-01-21T06:47:46Z,2,briancarper.net,Org-mode is awesome
2012-01-25T01:51:04Z,1,chron.com,Facebook forces Timeline; tips to hide users' past
2014-09-25T22:15:42.000Z,2,lists.debian.org,Second round of bash security patches out
2012-09-26T15:45:11Z,2,"",Ask HN: Is copying (and modifying) Terms of Service legal?
2012-04-26T16:18:30Z,1,bostinno.com,Iteration can't save you
2008-06-10T17:29:11Z,1,theregister.co.uk,Ps urge action as spooky caller ID-faking services hit UK
2011-07-29T03:24:41Z,63,feedproxy.google.com,Redis 2.4 will be released tomorrow
2011-01-02T02:41:20Z,10,"",Ask HN: Finding a remote job / Creating a resume
2010-11-21T22:52:39Z,1,bit.ly,Economy friendly website
2013-03-20T11:20:32Z,1,sauliuz.com,Funding your tech products with customer money
