2009-03-09T04:25:52Z,17,arstechnica.com,Why we've reached the end of the camera megapixel race
2010-08-26T08:55:36Z,3,blog.smartupz.com,Facebook-like app for customer communication that turns email into an SMS
2010-10-20T00:21:13Z,1,developers.notionink.com,Notion Ink developer program opens
2012-07-24T23:20:56Z,1,thehackernews.com,CVE-2012-2808 : Android 4.0.4 DNS poisoning vulnerability Exposed
2014-04-14T05:02:13Z,52,commbank.com.au,How not to respond to Heartbleed – CBA an Australian bank (read the comments)
2008-12-18T15:09:19Z,1,sfgate.com,Venture capitalists' 2009 outlook bearish
2012-12-14T14:21:31Z,1,mashable.com,4 Best Practices for Digital Marketers in 2013
2011-04-03T19:46:34Z,5,babblingvc.typepad.com,VCs Stripper Poles and G-Strings
2011-06-14T04:21:58Z,1,dakotatorres.com,Graphic Designer: SITE REMADE
2013-07-03T17:14:52Z,1,dropdownmenu.name,Show HN: A visualization of the colors used by top websites
2012-03-19T08:56:36Z,1,azulbeauty.com,Cosmetic Surgery Bonita Springs
2011-01-27T07:52:00Z,2,brisbanetimes.com.au,Why business partnerships and co-founders are bad
2014-02-11T06:37:27Z,4,phys.org,athematicians calculate that there are 177147 ways to knot a tie
2011-09-27T13:32:18Z,2,saleskick.me,12 things that may be wrong with a poorly performing direct mail campaign
2013-02-19T21:40:25Z,3,kirotv.com,How high is too high? KIRO tests pot-smoking drivers to find out
2011-07-07T05:53:01Z,1,ycombinator.posterous.com,ZeroCater (W11): Because Lunch At The Office Doesnt Have To Be A Complete Pain
2012-11-27T05:31:59Z,1,slashgear.com,Hacker selling $700 Yahoo email exploit
2013-08-15T12:58:59Z,1,bigdata-startups.com,From Big Data to Big Mac; how McDonalds leverages Big Data
2009-05-08T13:34:12Z,1,nokiafanboy.com,ajor Update of Nokia N96
2010-03-17T13:49:30Z,1,covers.com,6 Best Dunkers in the NCAA Tournament
2012-02-07T02:29:55Z,4,datasyndrome.com,The power of macros in Pig
2014-01-28T23:13:16Z,1,blog.mongohq.com,ongoHQ releases two-factor authentication and account security auditing.
2012-02-14T22:57:49Z,3,"",Who are the StartUpHustlers?
2011-06-29T15:22:29Z,137,blogs.hbr.org,Local Food or Less Meat? Data Tells The Real Story
2013-08-16T19:58:45Z,2,"",Ask HN: Has anyone here attended Draper University?
2013-05-05T08:33:44Z,2,xibxor.com,Non-Coalescing OR operator
2012-07-13T03:51:22Z,2,"",Ask HN: Best Python web framework? 
2010-02-23T05:06:53Z,2,blogs.msdn.com,Careful with that axe part one: Should I specify a timeout?
2013-08-18T02:42:52Z,9,medium.com,I cried a week after I moved here
2011-02-12T06:20:08Z,1,beautiful-wallpaper-collection.blogspot.com,Latest Salwar Kameez Collection: Designer Salwar Kameez
2012-08-03T23:31:28Z,13,plus.google.com,Scoble: Filepicker.io helps you offer great cloud-handling features
2010-08-24T19:59:42Z,1,catalog6continents.com,World Ads and Dating Service
2011-06-09T02:49:29Z,2,finishing.com,Is deionized water safe to drink?
2009-02-03T04:51:42Z,19,john-sheehan.com,Being Good
2015-01-05T14:55:47.000Z,1,nature.com,Programming tools: Adventures with R
2010-01-19T17:13:10Z,1,beutifullcars.blogspot.com,SPORTS CARS: HONDA JAZZPRELUDEACCORD AND CIVIC COUPE
2009-12-29T14:47:43Z,14,johndcook.com,Fear of tech commitment
2014-01-10T14:02:59Z,1,slideshare.net,CultureCode: collection of company culture slidedecks
2013-03-20T20:01:56Z,1,stoker66621.wordpress.com," ""Cyborg"" Santos to Star in Australian-Cagefighting-Freak-Show | The Red Edge"
2012-06-27T18:42:31Z,4,theverge.com,Google Glass Explorer Edition $1500 pre-order shipping next year
2011-10-31T03:18:32Z,1,truthsaboutsixpack.blogspot.com,Truth about Six Pack Abs - Lose Belly fat  Eat Right and Exercise Regularly
2011-03-24T20:21:44Z,2,blog.apievangelist.com,Data APIs and Exploration with Infochimps
2014-04-15T23:24:42Z,1,coindesk.com,Potential Mt. Gox Buyer: Exchange Has Important Role in Bitcoin’s Future
2008-11-10T18:52:33Z,2,hbswk.hbs.edu,Social Media Leads the Future of Technology [But We Can't Make Money Now]
2014-10-18T16:34:57.000Z,2,twittercommunity.com,Twitter API 1.1 and Twitter Search Have Different Results
2012-01-12T21:03:39Z,2,guardian.co.uk,Indian computer tablet could herald an Internet revolution
2008-10-29T06:57:51Z,2,hackszine.com,3d Wifi Blimp
2012-01-26T14:26:41Z,2,mashable.com,Tips for Building a Strong Online Community Around Your Startup
2010-03-10T22:48:01Z,1,tug.org,The TeX showcase
2014-12-04T19:54:06.000Z,1,pyzo.org,Pyzo – free and open-source computing environment based on Python
2011-04-06T12:28:11Z,1,allkarebuildingcontractor.co.uk,Loss Assessors
2010-06-26T01:29:39Z,1,wholesale-productsinfo.com,The Freshness of Pine Scented Cleaners
2013-03-13T12:16:24Z,7,inc.com,Peter Thiel Talks About the Day Mark Zuckerberg Turned Down Yahoo's $1 Billion
2014-05-19T17:55:19Z,7,superliminal.com,agic Cube 4D
2014-07-23T17:20:08.000Z,11,austinhutchison.com,Show HN: “Who's Hiring” Trends
2010-12-09T02:05:24Z,1,businesswire.com,"ASTERCARD and NagraID Security Present ""Information Display Cards"""
2011-06-13T18:51:36Z,6,cnbc.com,Facebook IPO valuation could top $100 billion possible in Q1 2012
2010-03-19T03:27:06Z,1,kenzi-menarapalace.com,Hotel Kenzi Menara Palace website - Marrakech
2011-05-13T11:41:51Z,1,youtube.com,The Speed Camera Lottery - The Fun Theory [video]
2012-12-03T22:13:45Z,3,computerworld.com,OSs are leaving the user out of user interfaces
2013-08-20T23:34:36Z,16,scoutzie.com,YC S13 Top beautiful websites
2012-07-31T22:15:50Z,1,ohioquotes.com,Health Insurance Columbus Oh
2013-08-26T18:56:01Z,1,treehugger.com,Giant solar plane could stay airborne for 5 years replace some satellites
2015-02-09T11:40:20.000Z,4,www.extra-www.org,Extra 'www'
2015-01-30T14:28:26.000Z,7,dadaviz.com,To Win a Deal on Shark Tank It's Best to Be in a Team
2015-03-10T16:23:58.000Z,2,lynxsy.com,Show HN: Lynxsy Internships – A new way for college students to find internships
2013-02-23T14:40:07Z,2,oscars.silkapp.com,Pirating the Oscars
2013-10-07T14:58:16Z,1,github.com,Light noise full control templating for JavaScript
2011-03-30T10:56:33Z,4,wrongknobs.nfshost.com,Struggling with ExtJS config settings?
2013-08-01T17:40:41Z,1,newstatesman.com,You are weird and 17 other things we learned from Ofcom's Report
2012-11-26T14:24:17Z,1,lwn.net,An interesting HTTP injection rootkit
2013-04-13T21:36:29Z,49,lukethomas.com,How to Land a Job at a Startup (Even if you live in the middle of nowhere)
2010-01-28T16:40:42Z,1,pcmag.com,Apple Event In Pictures
2012-04-20T08:39:01Z,18,eastist.com,Seedcamp Tallinn: making the Estonian president proud
2014-09-23T17:48:01.000Z,2,github.com,If you're into color and computers check out JuliaLanguage's color.jl library
2015-03-17T09:29:41.000Z,1,,Ask HN: List of “must do's” before launching iOS app
2012-05-01T19:00:50Z,1,mockcrunch.com,Control your city with King For A Day the Turntable.fm of local government
2011-12-27T02:53:13Z,2,idfspokesperson.com,8 Incredible Technologies used by the IDF
2012-01-05T15:35:03Z,4,wfaa.com,ICE deports US citizen to Columbia; teen missing since 2010
2015-01-14T04:20:51.000Z,1,medium.com,How to Get Away with Contradictory Statements
2013-07-25T03:14:31Z,79,people.xiph.org,Next generation video: Introducing Daala part 2
2011-09-01T00:58:31Z,44,techcrunch.com,Google Quietly Rolls Out The Chrome Extension To Bring +1 To The Entire Web
2011-11-06T13:57:01Z,1,oronljus.org,Det blir bttre och bttre
2008-03-24T15:21:20Z,2,youtube.com,State of the X window system
2011-11-19T06:39:57Z,1,blog.livedoor.jp,""
2010-08-25T15:34:33Z,2,"",Ask HN: Intro to molecular biology for a math/compsci background?
2013-08-07T20:29:30Z,3,uniqlo.com,Uniqlo calendar (2009)
2012-01-17T06:07:14Z,6,blog.jitsu.com,Building a distributed and anonymous cloud database
2012-05-20T23:29:26Z,2,reuters.com,Google's Schmidt challenges: no screen time for 1 hour a day
2008-04-01T13:01:47Z,1,blog.slickedit.com,Coding tips: Generational Naming
2009-01-30T22:26:03Z,9,"",Ask HN: How to learn languages with non-Latin alphabets?
2008-11-20T13:09:30Z,1,rafting.co.uk,Whitewater Rafting For Family Vacations
2007-06-10T19:46:33Z,6,"","When will we see ""ball cams"" in sports?"
2012-08-29T15:18:05Z,1,theregister.co.uk,Privacy warriors win right to fight Google's itty-bitty FTC payout
2013-12-23T01:46:16Z,8,apps.npr.org,Planet Money Makes a T-Shirt
2011-09-06T03:39:27Z,1,squidoo.com,Best Baby Bath Toy from 5TH Super Deal Exclusively at  Geartaker.com
2012-03-30T07:48:50Z,3,dailydot.com,YouTube's traffic still affected by the Reply Girls
2013-10-12T04:48:57Z,1,github.com,RecDB: A Recommendation Engine built Inside PostgreSQL Database System
2011-08-05T18:17:15Z,14,bloomberg.com,Facebook Cites Smoking Gun Proof of Fraud by Paul Ceglia
2012-08-30T04:37:35Z,1,appdev.cbronline.com,Oracles latest Java version could be vulnerable to hackers: report
2011-08-16T06:54:51Z,1,ws126.net,""
2008-10-06T08:53:05Z,1,technologizer.com,Ask.com: 3 Years of TV Ads Prove It's Time to Bring Back Jeeves
2013-11-01T23:26:04Z,1,midsizeinsider.com,With Constant Data Connections Are We Ever Really Alone Anymore?
2013-09-12T13:58:34Z,2,vimeo.com,If you grew up in the 50's through the 80's...
2014-08-16T08:45:44.000Z,4,hitmusicbox.com,Show HN: Curated music stations using YouTube
2013-10-08T22:35:07Z,13,"",Ask HN: What are your favorite time management tools? 
2013-08-14T02:49:44Z,1,telegraph.co.uk,edical Ethicists conclude After-birth Abortion same as killing Unborn Babies
2011-04-29T08:14:38Z,9,mashtext.mashmobile.com,SMS from any browser fully sync'd with your Android phone
2014-08-27T20:25:23.000Z,10,spectrum.ieee.org,Quantum Entanglement Camera Images Object with Photons That Never Come Near It
2012-01-04T14:28:08Z,1,infoworld.com,The power of observation -- and superglue
2013-02-06T15:33:40Z,30,pivory.com,Project Ivory - Features and the Testing Thread
2010-02-11T19:52:52Z,3,gtmetrix.com,GTmetrix: web-based pagespeed/yslow reports
2009-02-03T12:35:22Z,44,nytimes.com,A Company Prospers by Saving Poor People’s Lives
2015-03-18T17:40:27.000Z,99,somethingsimilar.com,Notes on Distributed Systems for Young Bloods (2013)
2014-02-05T23:01:00Z,2,support.apple.com,ICloud: iCloud security and privacy overview
2009-01-15T12:33:37Z,16,launchlab.co.uk,How do you treat your kids when your startup is a success?
2011-08-29T14:24:53Z,1,solarpathlightslights.com,Solar Path Lights is useful for our garden lighting
2015-01-13T16:06:08.000Z,2,mic.com,Science Denier to Head US Sen. Subcommittee on Space Science and Competitiveness
2009-02-23T17:07:15Z,1,boston.com,What you're really pouring from that carton of orange juice
2014-05-22T17:28:52Z,2,impossiblehq.com,An Unexpected Ass Kicking
2015-03-16T05:34:46.000Z,4,kickstarter.com,Cuberox – a six-screen waterproof linux-powered computer on Kickstarter
2011-05-30T01:55:26Z,2,spekios.com,y Startup: forget the outdated craigslist model
2012-12-11T17:53:36Z,293,blog.23andme.com,23andMe raises $50M cuts price to $99 sets goal of 1M genotyped customers
2012-04-17T17:39:32Z,2,sysnews.ncsu.edu,University mail hosted on Google Cloud goes down
2009-05-20T10:11:13Z,6,codejustin.com,What are the best sites for programming news?
2012-07-25T06:54:46Z,6,"","Ask HN: Technical Cofounder for ""Gap Year Challenge"" Media Company"
2010-01-31T22:57:59Z,1,gaiagps.com,Ask HN: Is this good Chinese?
2015-01-29T02:16:00.000Z,4,blog.riscv.org,Videos of talks from the First RISC-V workshop and bootcamp
2012-02-03T03:19:08Z,1,hoppslimited.com,How  To Improve Your Web Design Right Now
2013-06-21T13:41:49Z,1,accella.net,Sending a video content to a DLNA/UPnP software/device using curl
2011-09-26T22:16:29Z,1,uk.salesjobs.com,Sales Jobs are Still Flourishing
2009-12-22T23:30:41Z,1,blog.mekdigital.com,Heroku CNAME Entry Valid?
2011-07-06T04:54:18Z,1,latimes.com,Netflix expanding into Latin America
2012-11-25T19:20:59Z,1,"",Ask HN: Which startups came out of MIT?
2011-08-26T22:15:44Z,1,time.com,How Programmers Get Rich (Time Magazine article from 1982)
2014-12-10T02:10:43.000Z,4,bloomberg.com,Uber sued by SF and LA prosecutors
2009-05-30T03:36:56Z,1,hifumedicalcenter.com,Urology Specialists In Hackensack New Jersey
2012-06-19T20:30:42Z,23,"",Ask HN: What are some excellent blogs by *technical founders*?
2013-05-08T03:58:18Z,1,secondavenuesagas.com,Some thoughts on building the ideal transit app
2013-01-22T18:27:33Z,1,"",Come Hack in Medellin Colombia: Feb 2013
2008-07-05T12:59:35Z,2,sitepoint.com,Top 5 Tips for Staying Awake
2015-02-24T14:52:57.000Z,2,blog.atomicinc.com,Do VCs Abandon Startups?
2015-01-26T20:17:17.000Z,1,ittechexplained.wordpress.com,IT Explained
2013-04-01T18:14:25Z,1,amazon.com,The Rocket Company (Kindle Edition) Free Today on Amazon
2011-05-16T23:11:49Z,1,tartarus.org,Porter Stemming Algorithm
2012-04-22T12:28:20Z,1,29decibel.github.com,Ruby api client for Readability service
2012-01-12T04:34:23Z,2,wired.com,Google’s Data Center Engineer Shares Secrets of ‘Warehouse’ Computing
2009-06-27T14:16:21Z,16,wired.com,NASA Wants Your Ideas for Digitizing Rocket Scientists Notes 
2014-12-27T21:07:09.000Z,2,"",Running Alpha Brings Invisibility Cloaking to Financial Decision – Making
2014-01-31T23:15:08Z,1,venturebeat.com,StartApp hits 1.5B downloads 10X growth in 18 months
2009-06-01T18:02:11Z,4,sites.google.com,What Plagiarism Looks Like
2013-09-30T21:37:33Z,1,fixedbyvonnie.com,How to speed up Safari
2014-05-19T23:44:33Z,4,youtube.com,Octopus Walks on Land at Fitzgerald Marine Reserve (Video)
2012-08-17T15:33:25Z,1,securityweek.com,icrosoft Update Forces Minimum Certificate Key Length of 1024 Bits  
2014-06-25T01:28:51.000Z,1,sketchfab.com,100 million years old crocodile fossil
2014-04-21T20:12:58Z,1,fastcompany.com,The Mayo Clinic's New Doctor-In-An-iPhone
2013-07-16T20:36:50Z,2,medium.com,What it really means to be a junior developer
2015-01-28T22:47:14.000Z,3,dontletmegethangry.com,Show HN: Don't let me get hangry
2011-01-07T15:24:55Z,1,seonoobie.com,The Daily Show Discusses The Facebook Hoopla
2013-12-15T13:36:02Z,186,prog21.dadgum.com,Don't Distract New Programmers with OOP
2011-03-01T17:01:41Z,14,techcrunch.com,Loopt (YC S05) To Get Pushy With Big Flash Deals At SXSW
2014-01-08T14:15:40Z,2,blog.chrismahon.com,An Hour a Day
2010-10-04T18:41:17Z,12,intridea.com,Announcing OmniAuth: Flexible Unassuming Multi-Provider Authentication for Rack
2011-10-26T16:59:09Z,1,postdesk.com,David Lloyd (illustrator of V for Vendetta) talks about that now infamous mask
2011-03-24T02:01:40Z,1,"",How I came to understand the App Store model
2011-08-17T02:45:24Z,2,cs.cmu.edu,IT's Lisp LOOP macro horrorshow (1981)
2011-08-12T19:39:43Z,105,blog.mozilla.com,Old Dijkstra Essays Considered
2011-06-08T13:34:38Z,30,blog.transloc.com,Sometimes What's Normal is Pretty Absurd.
2009-02-03T02:10:39Z,1,drnicwilliams.com,ChocTop - packaging and deployment of Cocoa applications
2014-03-17T17:44:38Z,1,artlebedev.com,Idea worth minus a million
2014-10-31T15:56:35.000Z,1,techpinions.com,Profitable Cores and Reinvention
2008-09-19T16:33:05Z,1,thedeal.com,Web 2.0 Expo reacts to Wall Street crisis
2012-01-17T18:58:04Z,1,fastcompany.com,After Prescient Pivot Aviary Tools Now Seeing 10 Million Photos A Month
2011-08-09T11:04:53Z,1,backgroundfinder.com,Background checks
2015-04-20T20:25:43.000Z,2,memsql.com,MemSQL (Y 11) is hiring Database Engineers and Field Engineers
2012-10-18T12:12:27Z,1,t.co,After 80 years in print Newsweek will go all-digital.
2011-11-17T06:39:04Z,1,cloudbusinessreview.com,Will the Cloud Reign Supreme?
2015-04-14T19:18:31.000Z,2,druva.com,Enlightening Storage and Networking Experts to Follow on Twitter
2011-09-08T09:01:36Z,1,yzqqhw.com,""
2014-06-09T21:03:06.000Z,1,puzlet.com,Energy balance: the simplest climate model
2014-10-09T11:18:38.000Z,1,"",Continue or Quit?
2012-12-20T20:51:40Z,1,techcrunch.com,eet Facebooks Stealth Marketing Platform Publishing Garage
2012-06-13T18:33:51Z,1,postdesk.com,Introversion's Mark Morris: Why now is the best time to be an indie
2012-05-07T16:42:26Z,1,theamericanscholar.org,Toys and Joys
2012-03-26T16:20:41Z,1,cd-keys.at,Game Moguls Minecraftpack
2012-05-10T00:47:41Z,1,steelchief.com.au,Garden Sheds | Garden Shed | Garden Sheds Online  Steel Chief
2015-02-22T17:18:08.000Z,1,youtube.com,MIT Physics PhD student stand-up routine
2013-10-01T15:08:03Z,1,internetmonetization.com,How To Set Up FeedBurner for Wordpress in 4 Easy Steps 
2011-11-04T17:55:41Z,1,tablet-pcs.us,"Kindle Fire Full Color 7"" Multi-touch Display Wi-Fi"
2013-08-14T19:23:19Z,2,edition.cnn.com,ore than 100000 want to go to Mars and not return
2011-09-27T07:30:45Z,1,blog.medusis.com,All quiet on the Western front. Silence it's hard.
2011-11-22T22:43:02Z,2,businessweek.com,Buffett May Be No Match for Mobsters With Tattoos
2009-04-29T03:48:42Z,2,tylerlesmann.com,Copying Databases across Platforms with Python's SQLAlchemy
2008-02-21T21:10:19Z,8,the-shoebox.org,Shoes a Ruby GUI toolkit now has some sweet apps.
2012-01-07T20:49:05Z,9,refheap.com,RefHeap
2014-12-01T23:58:25.000Z,18,datagenetics.com,Battleship AI Algorithm
2013-02-15T15:46:06Z,1,successfulworkplace.com,eteor strike hits social networks news teams are caught snoozing
2014-01-30T17:39:45Z,9,medium.com,How I Discovered My Growth Opportunity at Balanced
2014-12-09T21:52:57.000Z,2,fee.org,Fifty More Ways to Leave Leviathan
2011-09-03T11:33:43Z,1,"",Ask HN: Should I get lawyer?
2012-11-06T18:26:11Z,1,gopollgo.com,Poll: What method did you use to vote or how do you plan to vote?
2014-11-28T10:34:07.000Z,1,bbc.co.uk,What makes space travel so dangerous?
2011-01-30T21:45:06Z,13,blogs.gnome.org,Cross Linux-Distro Application Installer
2011-08-22T13:19:20Z,2,"",Ask: C++ or C#?
2010-09-27T04:32:41Z,1,click4newz.com,Girls Hope
2009-04-27T02:45:28Z,1,"",Ask HN: Portable Shell Scripting resources?
2008-11-25T20:58:20Z,1,basedesign.com,Perspectives - Interviews without spoken words only body language
2012-06-11T09:26:52Z,3,youtube.com,3D printed model of time-lapse 3 ball Mills Mess (video)
2013-10-15T14:32:02Z,1,medium.com,Grand Theft Afghanistan
2009-03-05T15:53:46Z,17,mark.reid.name,Probability Estimation: An Introduction
2014-01-21T18:08:20Z,2,developer.yahoo.com,Best Practices for Speeding Up Your Web Site
2011-10-09T12:06:00Z,1,gfcforum.com,07 oct 11 - MicroBOX AIO: BLACKBERRY ALL meps 
2012-12-17T20:50:52Z,2,chronicle.com,Jump Off the Coursera Bandwagon 
2011-09-12T11:48:35Z,1,bhushan.vibhu.blinkk.me,Science and Vision
2013-06-23T02:43:09Z,85,businessweek.com,Booz Allen the World's Most Profitable Spy Organization
2010-12-06T09:20:20Z,1,sappeoplesoftoracleemaillists.blogspot.com,Salesforce CRM Users list.
2010-09-24T19:39:23Z,3,jwz.livejournal.com,AGNET WARS 
2012-03-29T20:27:24Z,1,ignorethecode.net,Simple Ideas
2013-09-10T01:09:29Z,1,techcrunch.com,The Data Factory  How Your Free Labor Lets Tech Giants Grow The Wealth Gap
2013-09-27T17:24:35Z,1,news.thehackernews.com,Tor Browser Bundle 3.0alpha4 Released - The Hacker News
2014-04-17T02:06:57Z,1,armoredenvoy.com,Secure Electronic Document Delivery: Keeping It Simple for Customers
2010-06-03T20:16:02Z,5,cablox.com,Neat cable organizer
2012-09-27T20:24:20Z,3,plosone.org,ale DNA in the Human Female Brain
2014-02-06T18:40:28Z,1,lozworld.com,Notes on a responsive Guardian redesign
2014-10-26T07:03:37.000Z,1,tally.tl,What's your favorite code editor?
2011-03-10T02:51:37Z,2,noiseaddicts.com,Can you hear this? (hearing test)
2015-03-15T20:41:36.000Z,1,airpair.com,The Legend of Canvas
2008-04-08T16:45:50Z,1,en.wikipedia.org,Orders of Magnitude
2011-03-14T02:43:59Z,4,tomdale.net,The Future of SproutCore's View Layer
2010-10-05T19:16:21Z,13,"",Ask HN: Sponsor my travel for Startup School
2014-11-10T04:52:22.000Z,106,reqr.es,Reqr.es
2014-02-20T05:32:58Z,5,"",Tear apart my consulting page
2012-09-13T04:24:55Z,1,soentrepreneurial.com,What Every Entrepreneur Thinks Before They Even Lift Their Head Off The Pillow
2013-05-06T21:22:28Z,2,blog.cliffano.com,Voice-Controlled Lamp Using Ninja Blocks
2015-04-18T03:11:39.000Z,1,youtube.com,Twelve Tones
2012-11-06T19:06:53Z,25,scirra.com,HTML5 games faster than native?
2013-01-09T11:05:34Z,2,blog.stackmob.com,Resources for Getting Started With Functional Programming and Scala
2011-07-06T17:53:07Z,1,cmscritic.com,10 Easy Ways to Start a Social Network
2014-09-23T09:01:24.000Z,1,motherboard.vice.com,The CIA Used Artificial Intelligence to Interrogate Its Own Agents in the 80s
2013-08-16T02:07:49Z,1,arstechnica.com,Once the province of Windows XP Web servers are hackers target of choice
2012-02-21T05:33:05Z,1,recyclingoldphones.blogspot.in,Sell a cell phone
2011-01-09T17:54:07Z,3,jacksonsun.com,Charter schools are the public education wave of the future
2015-03-04T13:01:38.000Z,6,asserttrue.blogspot.com,Amazon Sears merger makes sense
2010-01-28T03:20:36Z,1,tibconcerts.com,Ticketmaster - Live Nation merger
2014-08-19T05:24:12.000Z,5,"",Ask HN: What's the best resource to learn Python?
2010-04-19T20:09:49Z,126,itworld.com,Will Wall Street require Python?
2012-10-09T14:37:44Z,2,quora.com,Why is SV Angel so indecisive?
2014-10-16T18:39:26.000Z,2,brett.is,Python Redis Queue Workers
2012-03-01T18:26:05Z,6,devblog.bu.mp,Git for dropbox users: Don't be afraid
2011-12-25T08:18:59Z,1,naventa.com,Dynamic Process markedsfring p Internettet
2011-08-29T11:44:46Z,1,docs.nodejitsu.com,Node docs/tutorials from Nodejitsu
2011-07-29T10:18:59Z,1,autotransport1.intodit.com,How to choose an auto transport company
2011-06-02T15:55:26Z,2,arstechnica.com,Samsung Galaxy Tab 10.1 arrives on June 8 with Honeycomb 3.1
2011-11-21T13:29:02Z,1,eblogresources.com,Vassy Free Wordpress Theme
2012-10-25T12:36:34Z,2,arstechnica.com,Copland 2010 revisited: Apple's language and API future
2012-10-22T19:17:44Z,6,minimak.org,inimak: The benefit of Dvorak without losing your investment in QWERTY
2014-12-04T15:34:52.000Z,2,engadget.com,New tech uses ultrasound to create haptics you can 'see' and touch
2012-06-22T14:16:18Z,2,ubuntulife.net,Whats new in Ubuntu 12.10 Quantal Quetzal Alpha 1?
2014-10-07T17:20:11.000Z,2,medium.com,The Future of Social Media - Reddit Yelp and cryptocurrency — oh my!
2012-11-25T13:52:49Z,68,mojang.com,inecraft augmented reality app announced for iOS
2013-03-31T18:38:09Z,1,12perks.com,Interpersonal communication skills to best serve your client
2011-01-03T22:17:44Z,11,"",Ask HN: How do you know when to walk away?
2013-01-30T05:03:14Z,2,whitehouse.gov,The White House speaks on Immigration
2011-11-09T05:27:48Z,1,pinoyfunstuff.blogspot.com,Dionisia Me Seeds Funny Aling Dionisia Jokes | Funny Manny Pacquiao Jokes
2012-01-23T17:04:37Z,2,flickr.com,The central nervous system of New York City -- based on tweets
2010-10-06T07:01:02Z,1,techdrawl.com,The Future Just Aint What It Used To Be
2014-03-12T16:31:14Z,1,bbc.co.uk,Google buys up games controller firm Green Throttle Games
2012-12-27T19:24:32Z,1,apievangelist.com,New API Stories in 2013
2011-11-07T15:36:40Z,1,spectrum.ieee.org,Creepy Crawly Slug Robot Has Tank Treads for Skin
2010-09-04T15:44:58Z,3,rwcc.g-star.com,agnus Carlsen vs. The World 
2013-12-01T09:54:41Z,3,idreamedofthis.com,What I REALLY Think Of The Philippines...
2009-05-28T20:12:24Z,1,blog.ewakened.com,JQuery and Colour: The cheapest way to enhance user experience
2009-04-24T11:13:51Z,1,adlogo.co.uk,Volume sports shirt printing
2013-05-19T11:02:14Z,1,github.com,Simple MongoDB gem for small Ruby apps/scripts
2012-11-09T23:53:05Z,2,gist.github.com,CSS for easier wide-screen HN reading
2014-01-30T12:10:09Z,7,xkcd.com,Protocol
2008-10-24T13:15:20Z,2,taptaptap.com,The easy way to get into the iPhone app game buy a proven app
2010-05-21T19:14:14Z,1,news.sky.com,Scientist Claims To Make First Man-Made Cell 
2013-05-10T18:13:18Z,1,techcrunch.com,Google Brings Its Cloud Messaging Push Notification Service To Chrome
2011-02-06T03:29:48Z,1,packersmoversservices.in,Packers Movers Delhi Packers Movers Mumbai Packers Movers Ludhiana
2011-06-02T18:53:41Z,4,life.icrontic.com,Tokyo sends a clear message: stop monster-on-child rape
2011-11-16T15:11:12Z,1,jobposting-tech.com.ar,Desarrolladores .NET SSR/SR - REF
2013-06-16T07:03:16Z,1,moneychoice.org,100 Years of Change
2014-04-09T16:32:15Z,1,cnet.com,Samsung Gear Fit evolves with newest software
2012-04-19T05:37:55Z,1,dissertation-help.co.uk,Formulating Research Question| Formulate a  Research Question
2014-01-07T15:49:02Z,1,gamefromscratch.com,Godot Unity like game engine going open source
2013-05-01T15:41:44Z,2,se.inf.ethz.ch,C2Eif - A C to Eiffel translator
2011-09-14T14:50:50Z,9,arstechnica.com,asochist me? An Ars writer's iPad-only workday
2009-03-26T10:33:51Z,1,"",What would you ask a porting house?
2012-02-04T10:07:58Z,1,thatsnotcamping.com,Old Town Campground 'N Retreat
2011-11-12T21:52:02Z,1,ajlpawnshop.com,Whittier jewelry 
2014-09-27T11:19:17.000Z,1,blog.coursebirdie.com,10 CEOs You Should Be Following on Twitter
2007-08-22T22:28:27Z,14,merricklozano.com,Y Combinator's Hacker News NoFollows Some Links?
2011-03-14T16:21:35Z,2,caycon.com,Name the Big Three Social Networks for Business
2012-10-23T17:41:59Z,68,blog.gaborcselle.com,Every Step Costs You 20% of Users
2014-02-15T15:00:09Z,1,karlcoelho.github.io,Ruby on Rails Tutorial by Micheal Hartl – with better UI.
2014-02-24T03:04:26Z,1,quora.com,Will equity crowdfunding platforms kill Angel Groups and Early Stage VCs?
2011-08-24T19:01:09Z,2,wnd.com,Look who Obama's hired for cybersecurity team
2011-01-16T19:42:10Z,16,techcrunch.com,True Ventures Entrepreneur Force Pays It Forward To Budding Tech Leaders
2011-04-07T20:50:53Z,2,bizjournals.com,TripAdvisor splits off from Expedia
2013-03-21T20:32:59Z,11,purpleunions.com,Starbucks CEO Tells Marriage Equality Haters to Sell Shares in Company
2013-03-19T16:00:46Z,1,forbes.com,Warning: 7 Steps to Startup Failure
2013-05-29T13:24:33Z,2,pcworld.com,icrosoft moving bot-busting fight to the cloud
2014-06-18T16:01:17.000Z,30,businessweek.com,Proterra an Electric Bus Maker Aims to Follow the Tesla Model
2014-05-06T18:57:39Z,2,blog.heroku.com,Heroku Two-factor Auth in Public Beta
