2013-05-22T12:02:20Z,1,happybootstrapper.com,Churn Walkthrough Part I: Defining Active And Lost Customer
2013-04-05T11:00:52Z,1,millwoodonline.co.uk,Deploy PHP to Heroku
2014-12-16T22:20:33.000Z,11,fastcoexist.com,Can America's Desert Cities Adapt Before They Dry Out and Die?
2013-08-15T01:35:20Z,1,ergoemacs.org,ErgoEmacs - Ergonomically modernized Emacs
2007-03-21T20:22:31Z,21,"",I will tell you why it's so freaking hard for single founders: It's so freaking lonely
2015-02-16T11:56:35.000Z,1,guardtime.com,What Do HSBC and Anthem Have in Common?
2011-07-25T10:19:25Z,8,"",HiddenApp goes AWOL?
2012-09-05T20:09:21Z,1,"",Ask HN : Any devs watch the Frontend Master Videos?
2012-04-19T11:18:07Z,1,substancehq.com,The simple blog engine - Substance
2014-11-17T18:49:52.000Z,32,highscalability.com,Aeron: Another messaging system
2015-01-28T07:20:06.000Z,1,en.wikipedia.org,Privy purse in India
2010-11-01T01:51:50Z,1,cpricelandscapes.com,Come on google need this site up and seoed again
2014-12-30T22:34:14.000Z,6,hackread.com,Nvidia  Network Breached 500+ Staff Urged to change account details
2011-10-28T15:47:26Z,1,arab-timess.blogspot.com,"     "
2011-06-10T15:51:00Z,1,dawn.jpl.nasa.gov,Dawn Mission
2014-05-06T17:47:10Z,2,simonsfoundation.org,In social bees and loners a hunt for the genes behind social behavior
2012-02-23T22:52:18Z,2,clickorlando.com,Facial recognition being rolled out to boost sales at retailers
2009-04-22T17:56:11Z,5,pcworld.com,Criminals Pay Top Money for Hackable Nokia Phone
2015-02-04T16:30:35.000Z,1,github.com,Elasticsearch for Beginners: Index and Search Hacker News
2011-06-03T16:52:35Z,57,dshipper.posterous.com,Battle In The Boardroom: Why Groupon Probably Paid Off Its Early Employees
2011-01-14T05:42:43Z,1,p2pu.org,Learn Python the Hard Way: P2PU School of Webcraft
2014-10-31T18:18:12.000Z,18,lists.torproject.org,Facebook brute-forcing hidden services
2011-09-14T18:03:17Z,3,readsideways.com,Don't Ever Use This Word With Developers
2013-12-30T20:26:18Z,1,sunlightfoundation.com,The year's top politicians and their best deletions from Twitter
2011-04-04T19:55:13Z,12,devblog.blackberry.com,RIM just doesn't understand it's developers
2012-11-08T18:41:35Z,13,blog.adstage.io,Documenting and Assessing an Ad Experiment across Search and Social
2012-02-22T15:38:52Z,16,laravel.com,PHP meet elegance. Laravel 3 has arrived.
2012-04-06T09:44:04Z,1,getapp.com,6 Most Irresistible Business Boards You Must Follow
2011-08-18T22:04:30Z,5,thisismynext.com,HP: ‘We are not walking away from webOS’
2013-07-29T00:12:43Z,61,nybooks.com,A Lecture on Johnson and Boswell by Jorge Luis Borges
2008-10-17T22:53:17Z,1,uncov.com,Paul Graham Just Shut Your Face Already
2012-07-15T14:40:46Z,1,online.wsj.com,Flummoxed by Failureor Focused? 
2011-09-28T20:03:13Z,1,untether.tv,Two Guys on Mobile - Episode 27: Amazon's Fire and Silk + GigaOm's Mobilize
2013-03-30T00:10:30Z,1,cagestokerblog.blogspot.ca,Gore Video: Brutal Truck Accident - Dying Man Bathed in Blood With Severed Limbs
2008-05-13T02:37:43Z,1,"",A brilliant! follow on to the Nigerian scam
2010-09-22T03:40:27Z,4,travel.usatoday.com,Hotel ousts couple after accusing them of writing negative TripAdvisor review
2011-02-05T20:10:23Z,27,en.wikipedia.org,Delta Debugging
2008-12-27T00:30:35Z,12,arstechnica.com,icrosoft Apple Google sued over icon software patent
2012-01-19T16:33:16Z,1,entrepreneur.com,3 Steps to Optimize Your Website For Google's 'Freshness' Update
2014-08-25T01:20:15.000Z,1,jonnyrowntree.com,Whats on my Nexus 5
2011-10-21T07:28:18Z,1,latinalaundromat.com,Find Laundromat phoenix
2013-12-03T09:54:06Z,4,linuxjournal.com,Linux Journal Readers' Choice Awards 2013
2012-07-23T20:03:55Z,1,printchomp.com ,Show HN: Printchomp print goods order/comparison engine
2015-03-26T10:59:49.000Z,1,wooey.martinfitzpatrick.name,Show HN: Wooey Web UIs for Python Scripts
2009-02-02T23:20:15Z,37,bits.blogs.nytimes.com,Google Executives Face Jail Time for Italian Video
2008-12-31T01:02:29Z,1,multiverseaccordingtoben.blogspot.com,Ben Goertzel: The Structure of the Physical World and Definitions of Intelligence
2010-07-02T13:01:56Z,3,"",Ask HN: Best Invoicing Software?
2008-09-18T18:56:35Z,3,economist.com,Wall Street's bad dream
2011-09-19T16:01:59Z,448,github.com,Twitter's Storm (complex event processing system) is now open source
2013-07-23T21:55:19Z,2,bigthink.com,NASA Scientists Are on a Mission to Break the Speed of Light
2011-08-24T08:46:58Z,1,lukew.com,Creating Engagement on Twitter
2012-03-02T15:48:44Z,1,"",Every password manager sucks - create a good one and be the next dropbox
2012-12-04T20:10:03Z,133,news.ycombinator.com,Hacker News: DMCA
2011-10-26T07:41:19Z,1,vetvoice.com,Nuevo perfil de viajes de aventura
2008-05-26T14:20:44Z,1,readwriteweb.com,Studios Should Look to Trent Reznor for Future of Distribution
2015-01-21T20:30:21.000Z,3,bbc.com,The drone operator who said 'No'
2014-10-22T14:15:41.000Z,1,theregister.co.uk,VCE to be absorbed into the EMC federation
2010-09-01T20:06:17Z,1,techcrunch.com,Live Nation To Power Concert Listings Ticket Sales In iTunes 10
2012-09-12T19:17:34Z,1,engadget.com,IPhone 5 vs. iPhone 4S: what's changed?
2011-02-14T14:53:49Z,3,foundora.com,Story & Challenges of Tangible Product Startups
2011-02-25T00:16:10Z,2,thehill.com,Consumer group wants to tax Netflix to pay for rural broadband
2013-12-27T17:47:55Z,1,conweets.com,ost Popular Twitter Conversations of 2013
2014-06-23T19:28:33.000Z,2,strd6.com,Hamlet Implementation
2014-11-06T18:46:46.000Z,8,priceillusion.wordpress.com,anipulating the Consumer Price Index: Hedonic Quality Adjustments
2014-05-06T15:45:06Z,1,shopify.com,A few notes on failing intelligently
2012-06-20T17:58:57Z,9,goodlifeproject.com,Dan Ariely on Hacking Human Behavior - Good Life Project
2014-06-14T14:32:27.000Z,1,qparticle.wordpress.com,Overview of antibiotic treatments
2013-11-26T15:35:31Z,23,linkedin.com,An understated job advertisement
2011-07-27T20:49:16Z,4,globalmoxie.com,Page One: Banish Multi-Page Articles on many news sites(Global Moxie)
2013-01-18T15:53:58Z,1,"",HN: What is your go to ecommerce technology? 
2013-10-25T01:04:35Z,1,jhatax.blogspot.com,Let's change Windows Update for tablets
2008-12-29T15:35:56Z,1,hubpages.com,FREE Coloring Pages - Kim Possible
2013-01-18T00:31:11Z,2,benwerd.com,Quiet hero
2013-01-21T20:00:00Z,1,blog.felixbreuer.net,aking a Math Conference Poster with Inkscape
2012-07-18T14:18:50Z,3,betakit.com,Top Hat Monocle Closes $8M to Bring Gamification to University Classrooms
2012-07-25T19:42:07Z,33,anyvite.com,San Diego: join us for SD Hacker News meetup #31 (Fri 7/27)
2013-09-28T20:31:54Z,7,thefacesoffacebook.com,Show HN: All 1.2 billion Facebook profile pictures
2010-11-30T17:52:41Z,8,"",Ask HN: Is Y Combinator basically just communism?
2008-07-25T05:09:56Z,7,astartupaday.wordpress.com,Y Combinator Challenge #4 - Outsourced IT 
2013-06-02T18:07:00Z,1,danielfrost.dk,One of the most untold stories about the Windows design
2011-01-21T17:33:59Z,1,goodgearguide.com.au,Taiwan develops face-recognition vending machine
2014-07-01T19:10:22.000Z,1,npmjs.org,Show HN: yo polymer-gulp (browserify/sass/browserSync/closurComp/uncss/vulcaniz)
2011-10-15T10:22:36Z,188,jeffwofford.com,A Programmers Greatest Enemy
2011-07-12T07:11:18Z,1,webpagetest.org,Performance Test of a new Techcrunch Article Page
2011-08-30T00:58:14Z,1,ajxzz.com,""
2010-10-15T14:07:38Z,43,"",Ask HN: Review My Startup - Hypernumbers The Team Spreadsheet
2013-08-13T09:53:31Z,1,winsupersite.com,Windows 8.1: First Notes from Build 9471 | WinSuperSite
2014-11-10T19:38:58.000Z,6,fcc.gov,FCC Chairman Wheeler's Statement about Obama's Statement
2011-11-28T23:32:01Z,1,deltawildlife.org,Delta Wildlife: Investing in the future of our wildlife resources
2014-01-07T19:09:29Z,4,nytimes.com,Will Digital Networks Ruin Us?
2007-10-04T12:46:17Z,2,pcworld.com,icrosoft Looks to Social Networking for Zune 2.0
2010-09-13T15:04:58Z,3,businessinsider.com,VillageVines: 10000 Members... In Just 2 Months
2013-10-07T17:16:26Z,2,github.com,Show HN: add inline article summaries to Hacker News (HackMIT 2013)
2014-04-24T13:10:18Z,1,code.google.com,Pocket C++
2011-11-04T11:58:37Z,2,misterwish.net,It still needs work.  What do you guys think?
2013-05-07T10:28:37Z,1,arstechnica.com,Spyware used by governments poses as Firefox and Mozilla is angry
2014-05-14T14:24:00Z,1,rudebaguette.com,Wheretoget.it raises €1.4 Million to build the Jelly for Fashion
2013-12-11T15:55:13Z,2,leanlovelife.com,The Lean Love Life - Apply Lean Business Principles to your Relationship
2014-08-01T15:08:49.000Z,1,gamasutra.com,Startup puts YouTubers at its center and that changes everything
2010-10-25T21:39:00Z,2,newsinfo.iu.edu,Data mining for political astroturfers
2010-03-15T06:06:41Z,1,finalbossform.com,Braintag: Storm The Celebrity Studio And Retake The Universe
2014-09-10T16:45:11.000Z,8,blog.sucuri.net,Critical Vulnerability in Joomla VirtueMart Extension
2012-01-22T10:47:18Z,3,hollywoodreporter.com,egaupload Drops Lawsuit Against Universal Music Over Viral Video
2013-12-06T05:46:49Z,1,arxiv.org,Bayesian Analysis of Epidemics - Zombies Influenza and other Diseases
2013-04-12T13:13:39Z,1,reuters.com,BlackBerry to ask regulators to probe report on returns
2012-07-10T17:50:51Z,1,blog.mobitto.com,1.08 Billion Smartphones in the World
2009-02-26T16:27:11Z,1,nytimes.com,Apple Tells Investors That Steve Jobs Plans to Return
2014-12-16T21:16:19.000Z,1,creator.ionic.io,Ionic Creator: Build hybrid apps via drag and drop
2015-02-12T14:20:07.000Z,3,github.com,Grunt-sanitize
2010-02-16T19:03:00Z,3,byze.us,How We Tripled Our Traffic - What Google Analytics Tells Us
2009-02-27T13:30:26Z,59,zedshaw.com,iddle Men Aggregators And Apologies
2011-12-21T21:19:06Z,6,digitaltrends.com,The 439 organizations SOPA opponents should worry about
2014-08-11T14:48:56.000Z,2,thenextweb.com,Wikimedia releases first transparency report
2014-02-21T13:15:35Z,1,"",Is it just me or are others finding HN has problems?
2015-04-03T11:19:17.000Z,4,medium.com,The curse of being an introvert
2013-09-03T15:13:22Z,1,css-tricks.com,Is there a line between web apps and web sites?
2009-03-04T04:58:22Z,1,forexrapsecret.com,Forex Trading Systems | Forex Traders
2010-10-29T05:59:22Z,1,blog.redfin.com,IE9s Viewport Code is Broken
2010-09-09T18:35:39Z,3,cs.berkeley.edu,How to Have a Bad Career in Academia
2013-09-26T01:49:50Z,3,bitcointrust.co,Bitcoin Investment Trust
2013-08-27T02:40:15Z,1,techexile.com,Review: Samsung Galaxy Tab 3 10.1
2011-05-25T13:08:33Z,2,economist.com,A correlation between well-being and wealth (Chart)
2011-08-07T14:39:14Z,5,google.com,Google - Klingon
2012-08-30T18:29:10Z,1,itunes.apple.com,Show HN: GitHub events in Mountain Lion's Notification Center
2014-10-14T19:18:00.000Z,7,cubeschallenge.com,Cubes Challenge: Optical Illusion Game
2011-06-07T16:28:21Z,1,mahashinicse.webs.com,Photos - Mahashin Talukder
2013-04-24T19:49:34Z,109,caisah.info,Emacs setup for Python development
2012-12-18T04:03:23Z,472,htmlist.com,Two-for-one: Amazon.coms Socially Engineered Replacement Order Scam
2010-04-10T22:16:59Z,1,"",IPhone Map Location/Business Query...
2011-11-22T06:25:22Z,63,diligentroom.wordpress.com,Liblime seeks trademark for an open source product created by an NZ library
2014-08-27T21:20:11.000Z,3,nautil.us,Future of Fossils: Print Your Own Dinosaur at Home?
2012-10-11T01:19:58Z,1,wolframalpha.com,WolframAlpha: Approximate Fibonacci Sequence
2014-10-17T16:36:40.000Z,1,twocentsonline.com,Show HN: Feedback on concept
2010-08-16T18:14:45Z,15,alternet.org,Bed Bug Infestation Is Scaring Millions Of Americans
2013-09-25T04:13:38Z,1,typecast.com,All you need is one font family
2010-09-16T16:43:16Z,1,community.microsoftadvertising.com,obile Advertising SDK for Windows Phone 7 Apps and RTB Exchange
2013-03-18T23:50:32Z,1,techcrunch.com,arc Andreessen Tim Berners-Lee Receive Queen Elizabeth Prize for Engineering
2015-02-20T18:52:22.000Z,2,codeascraft.com,Re-Introducing Deployinator now as a gem
2010-11-14T23:54:40Z,2,on.mash.to,AOL Unveils Project Phoenix Its New Webmail App
2011-11-25T10:52:31Z,1,jaqueslondon.co.uk,70th birthday presents
2008-12-08T02:03:49Z,1,anandtech.com,The RV770 Story: Documenting ATI's Road to Success
2011-01-19T22:44:20Z,5,whygitisbetterthanx.com,Why Git is Better Than X
2008-07-26T08:10:05Z,10,arstechnica.com,Hammer drops at last: FCC opposes Comcast P2P throttling
2014-02-27T23:42:45Z,1,a3nm.net,Propositions for EU copyright legislation
2009-05-14T18:26:12Z,1,calidagaming.com,Fridays meeting with the FIA and formula 1 teams.
2014-01-28T01:53:28Z,355,chiark.greenend.org.uk,The descent to C
2012-06-25T15:57:37Z,1,flamingspork.com,On Telstra tracking NextG HTTP requests
2009-04-17T21:41:08Z,1,techcrunch.com,Techcrunch is hiring developers
2015-03-04T19:34:45.000Z,2,xervmon.com,AWS Cost Analytics and On-Demand Support
2012-08-18T12:49:04Z,5,nytimes.com,"NYC bike share program delayed because ""the software doesnt work"""
2012-03-01T20:06:50Z,1,subbu.org,On Linking
2012-09-21T16:44:16Z,1,workstuff.tumblr.com,y issues with the new iOS Maps (It's not just about the data)
2012-06-07T11:40:44Z,1,bnjmn.org,An app store for Apple TV?
2008-08-19T16:50:21Z,4,arstechnica.com,Buzz and NewsCred: two different takes on social news
2009-01-28T04:44:16Z,2,smashingmagazine.com,Useful Design Tools For Beautiful Web Typography
2010-12-25T14:27:02Z,13,paul.kedrosky.com,Can Facebook Save California?
2010-11-29T15:23:59Z,1,foodandtechconnect.com,Food+Tech Bites 11/29  12/5 | Food+Tech Connect
2012-02-24T08:22:13Z,1,theorytest.beeplog.com,Drink driving facts and penalties
2014-05-18T18:46:23Z,1,devmanual.gentoo.org,Gentoo bash Guide
2012-02-06T16:50:48Z,1,uber.la,Just Click It; superbowl komen blog inbound marketing
2012-04-24T08:43:55Z,19,jonnystromberg.com,List.js  Version 0.2.1
2014-05-19T13:51:00Z,16,google.com,40th anniversary of the Rubik's Cube
2012-08-06T17:27:03Z,1,marketingplaninfo.com,Small Business Marketing Consultant: Are They Really Worth It?
2011-03-09T03:13:49Z,8,techcrunch.com,emolane Launches Its Personalized Internet Time Machine To The Public
2009-03-21T16:10:32Z,4,blog.stackoverflow.com,Stack Overflow - More Voting Anomalies
2012-03-02T17:37:07Z,1,addthis.com,Http://www.addthis.com/bookmark.php
2011-12-05T07:47:32Z,1,onlywire.com,Air Conditioner
2012-10-16T16:22:17Z,1,cnn.com,The CIA plot to get al-Awlaki
2010-12-06T03:03:22Z,3,straitstimes.com,Swiss Wikileaks.ch back online
2013-11-21T05:01:32Z,1,squad.io,Sports startup funding round is 1.5 million validations for Squadio
2010-10-14T14:57:19Z,3,bothsidesofthetable.com,Don't be a conference ho
2013-05-31T07:57:49Z,1,bigdata-startups.com,Have a look inside Facebooks massive data center
2014-12-24T00:53:33.000Z,3,dashingd3js.com,Data Visualization and D3.js Newsletter Issue 110
2013-12-04T18:37:31Z,1,brainpickings.org,Hemingway on Not Writing for Free and How to Run a First-Rate Publication
2013-05-16T12:01:03Z,1,renthousemap.co.uk?from=HN,Show HN: Looking for a place in the UK?
2011-02-12T02:05:37Z,1,newscientist.com,Bionic arms that amputees can control using their mind [video]
2014-05-19T16:43:13Z,307,firstlook.org,The NSA Is Recording Every Cell Phone Call in the Bahamas
2012-04-13T22:50:28Z,1,"",Ask HN: What makes a founder? 
2010-07-20T17:15:11Z,72,aloha-editor.com,Aloha Editor: an awesome HTML5 browser based editor
2011-11-22T19:43:01Z,2,nytimes.com,The Umbrella Man
2014-04-25T13:14:02Z,1,blog.chrismahon.com,Tomorrow is too late
2014-12-07T17:13:24.000Z,2,ionicabizau.net,Convert images to ASCII art with Node.js
2013-07-13T02:16:19Z,1,digitaljournal.com,HTML5 Hybrid Mobile App Developers' Meetup Announced for San Francisco CA
2011-02-07T05:52:17Z,1,rapidinduct.com.au,Know About Contractor Management Services
2014-05-03T15:13:22Z,19,facebook.com,Building out the infrastructure for Graph Search
2012-06-30T04:54:12Z,1,torrentfreak.com,egaupload Judge To Issue Order On Return Of User Data Shortly
2013-05-29T15:30:27Z,2,wired.com,Study: Killing Used Games Could Be Profitable or Suicide
2012-04-03T13:25:17Z,1,searchengineoptimizationjournal.com,FuseMail Email Hosting Has Major Service Issues
2012-10-09T12:30:51Z,1,infoq.com,att Wynne on BDD Cucumber Hexagonal Architecture
2013-12-18T10:33:59Z,1,logicmazes.com,What Logic Is Not
2007-07-23T12:50:55Z,3,tracksuitceo.wordpress.com,Supporting Your Family: So Easy a Caveman Could Do it
2013-06-05T15:46:34Z,2,mail.mozilla.org,Upcoming Gecko-based WebView for Android
2013-04-14T16:08:00Z,13,latex-community.org,New stable version TeXworks 0.4.5 released
2012-07-06T17:21:33Z,5,blogs.hbr.org,Less Confident People Are More Successful
2008-02-01T19:50:40Z,1,crowdspark.com," What Does Creativity Really Look Like?"
2012-06-01T14:54:33Z,10,schemafreedb.com,Show HN: SchemaFreeDB - Rapid Database Development
2010-09-04T06:34:54Z,1,scarlettlawgroup.com,Personal Injury Lawyer San Francisco
2011-06-28T01:32:25Z,2,lemire.me,On being happy
2013-06-13T17:24:29Z,17,launchsky.com,LaunchSky
2015-03-17T20:38:09.000Z,1,labs.studentrnd.org,What will your kid do Summer of 2015?
2011-05-27T05:47:22Z,1,packetlife.net,Intro to Scapy a framework for crafting and transmitting arbitrary packets.
2008-09-23T15:15:05Z,1,sethgodin.typepad.com,Seth's Blog: Probably not stupid
2008-03-30T16:51:31Z,1,blogtbt.com,This Blog is Rated-X
2014-07-15T01:23:44.000Z,6,theverge.com,Watch Boeing's 787-9 Dreamliner do things that would make you throw up
2011-03-30T08:51:45Z,4,birthdaybomb.squarespace.com,Help us conduct the biggest April Fool's joke on Facebook
2012-09-18T22:44:28Z,1,"",Ask HN: Does knowing Python give you a significant head start learning Django?
2012-04-10T20:14:39Z,1,youtube.com,Please give me feedback on my upcoming iOS game (not a DropZap sequel).
2014-11-07T10:40:24.000Z,2,fireserver.com.br,Fireserver Project Linux distribution that incorporates a Firebird database
2012-01-24T15:30:06Z,1,online.wsj.com,Average Silicon Valley Tech Salary Passes $100000
2010-04-04T21:55:54Z,1,supplydemanded.com,"The Evolution of Local Advertising and the Economics of a ""Check-In"""
2012-03-19T14:42:22Z,2,arstechnica.com,Researchers find privacy and security holes in Android apps with ads
2012-05-05T10:47:39Z,1,bestmusicquotes.tumblr.com,RIP MCA
2012-06-22T13:24:40Z,61,"",Ask HN: Web Dev Testing Best Practices
2011-01-12T22:50:55Z,2,sciencedaily.com,Polymer membranes with molecular-sized channels that assemble themselves
2013-08-02T17:49:02Z,1,inhabitat.com,an Tries to Smuggle Turtle Disguised as Hamburger Through Airport Security
2012-05-11T16:36:54Z,1,edceekays.blogspot.com,How and Why I think Malawi has to Move on with Software Localization
2008-10-18T19:57:36Z,1,"",Ask YC: Issues with submitting blog to Drupal-powered communities.
2011-12-27T14:46:19Z,1,brandignity.com,18 WAYS TO ADD TRUST TO Your WEBSITE
2012-06-19T09:30:29Z,1,bdarnell.github.com,Reading Thrift and Protocol Buffers without the boiler plate (python)
2013-05-06T16:34:34Z,1,project-syndicate.org,Lives versus Profits
2014-11-10T10:58:19.000Z,1,medium.com,Exorcising the Demon
2012-06-09T23:22:51Z,3,expectedpayoff.com,A 3D Printer On Every Desk In Every Home
2012-10-25T23:34:32Z,1,linkedin.com,Dear CEOs: get on Twitter and connect with customers
2011-09-28T23:15:03Z,2,multimarkdown.com,ultiMarkdown Composer
2012-04-16T07:45:27Z,1,thenextweb.com,"Ai Weiwei: ""The Internet is uncontrollable freedom will win"""
2011-07-01T16:08:17Z,16,bostinnovation.com,Why You Need To Intern At A Startup
2012-05-27T08:14:42Z,1,online.wsj.com,What workers lose by staying put 
2013-05-23T17:46:40Z,1,developers.meethue.com,API documentation for Philips Hue lightbulb
2013-05-07T13:18:43Z,1,uxmatters.com,4 Tips for a Great First-Use Experience
2008-04-09T00:28:43Z,1,alleyinsider.com,Wall Street Losing Patience with Yahoo
2011-11-02T13:19:19Z,1,vivalatour.com,St Petersburg Travel Agency
2011-05-19T13:31:10Z,4,youtube.com,ultitasking Impossible? Pretty girl plays Violin & DDR at the same time.
2012-02-20T20:28:45Z,1,"",Ask HN: Which Emacs to use on OS X Lion?
2011-03-16T16:58:56Z,1,eskimo.com,Skills Needed in Programming
2012-10-25T16:17:58Z,1,motif.ics.com,otif now freely available under the LGPL
2013-08-06T03:27:59Z,1,"",How useful is Azure storage's strong consistency property?
2012-02-24T14:54:13Z,1,corasystems.com,Project Management Software  Online Tour  ProjectVision
2011-06-22T08:50:49Z,2,junq.info,Science never fails: The Journal of Unsolved Questions
2012-12-25T10:28:36Z,1,progrium.com,Localtunnel v2 available in beta
2014-09-05T05:01:26.000Z,1,blog.flux7.com,Understand the intricacies of cloud benefits and cloud computing disadvantages
2010-07-28T11:46:06Z,3,blog.getyouram.com,Why Are We Better Than Google
2011-08-03T13:11:33Z,3,"",Ask HN: Migrating comments to FB-only brings solid benefits?
2007-09-15T03:04:38Z,1,networkworld.com,Company Demos Personal Aircraft Future Jetpack
2014-07-30T23:05:16.000Z,75,github.com,Poisson Image Editing in Python
2010-02-11T19:10:03Z,1,thechromesource.com,ac Users Can Now Enjoy Bookmark Sync Extensions in Chrome
2012-09-28T20:56:19Z,1,bloomberg.com,Bankruptcy Auctions Go Online to Boost Cash for Creditors
2014-04-29T11:17:41Z,1,quirky.com,Cool silicone snowboard cover
2009-02-04T20:32:15Z,2,"",Ask HN: Using open source platforms for web app development
2013-07-19T14:57:40Z,1,techonomy.com,Alibaba Turns To Travel As Profit Zooms
2012-10-18T20:08:57Z,2,creativemarket.com,Creative Market is open for business
2014-09-08T18:23:22.000Z,1,stocktwits.com,$MSFT at 14-year high heading into the Apple announcement
2015-04-15T14:04:35.000Z,3,opensource.com,3 steps to writing an open source project case study
2015-03-26T00:06:11.000Z,2,,Ask HN: Stock Quote REST API
2009-01-15T10:51:39Z,5,blog.wired.com,Steve Jobs Probably Won't Come Back to Apple
2010-07-15T21:30:48Z,1,nation.co.ke,Tokyo trials digital billboards that scan passers-by
2014-05-20T20:51:26Z,2,kurocha.blogspot.com,ITunes Concept
2011-07-18T10:49:33Z,2,broadsheet.ie,The Truth about Terms and Conditions
2013-02-26T08:46:54Z,1,ureddit.com,Featured class: Introduction to C++
2015-01-29T00:17:47.000Z,3,facebook.github.io,Facebook Fixed Data Table: A React component for building and presenting data
2012-11-22T13:02:15Z,2,hacks.mozilla.org,Fully Loaded Node
2012-02-15T21:22:35Z,789,shwood.squarespace.com,14 years ago: the day Teller gave me the secret to my career in magic.
2009-01-26T21:14:09Z,1,venturebeat.com,ore than 200 kids virtual worlds in development
2009-05-14T17:11:47Z,23,"",Ask PG: What is the running-total (summation) of all our Karma as users of HN?
2010-07-29T21:33:27Z,9,"",Ask HN: What startup are you working on?
2012-05-24T21:25:46Z,2,darkheartfelt.com,4 Ways to Brainstorm Like A Pro
2012-06-20T08:20:39Z,2,bbc.co.uk,Pete Townshend calls Apple 'a vampire'
2010-02-27T18:48:34Z,1,billingparadise.com,edical billing software
2015-02-11T19:15:14.000Z,21,yodelhealth.com,Show HN: Urgent care in your home
2012-03-23T07:21:37Z,1,articlesfind.info,Oxford Graduate Application 2012/13 | Ebook and PDF Search Engine
2012-03-21T08:30:02Z,1,gizmodo.com,Why you shouldn't read Gizmodo
2010-11-30T18:38:08Z,1,sessionmagazine.com,Pets as Wizards
2014-08-18T13:42:20.000Z,2,watchlistenobserve.blogspot.com,WikiLeaks' Julian Assange to leave embassy 'soon'
2008-12-30T02:45:04Z,4,007names.info,We are the worst registrar in the world
2011-04-21T23:45:06Z,3,nitrogen.posterous.com,Show HN: Kinect Home Automation goes HTML5
2012-08-06T02:43:08Z,1,blogs.atlassian.com,Our product helped build software for the Curiosity mission
2011-01-19T16:59:56Z,7,techcrunch.com,IPad Sales Outpace Every Prediction
2015-01-20T17:04:23.000Z,3,medium.com,A16Z Invests in Stack Exchange
2010-04-12T14:27:44Z,1,9lessons.info,Live Character Count Meter with Jquery.
2014-02-11T14:26:56Z,6,flowingdata.com,Learning R interactively with the Swirl package
2008-09-14T15:20:49Z,3,papers.ssrn.com,Leadership skills come from expert knowledge not interpersonal skills
2013-08-01T07:53:05Z,4,blogs.jetbrains.com,Get 10% OFF IntelliJ IDEA Personal License until end of August
2013-03-18T13:16:29Z,2,"",Tell PG: Browsers with old cookies not logging in
2014-02-24T21:00:10Z,162,code.facebook.com,Facebook Open Sources flint a C++ linter written in D
2010-08-09T07:07:45Z,1,amtecinc.com,Laser Marking Machine
2010-03-21T19:03:26Z,3,"",Ask HN: Domain Name Dilemma
2010-03-30T14:55:15Z,3,news.oreilly.com,Large Hadron Collider as Massive Grid Computer
2011-07-17T17:30:40Z,1,raftrowed.blogspot.com,Watchzindagi na milegi dobaronline freemegavideo
2011-03-01T18:39:08Z,5,develop-online.net,How the Box 2D hero caught Rovio out
2012-06-04T00:49:38Z,1,ndemiccreations.com,How Plague Inc. Became #1 in App Store
2015-04-09T16:58:10.000Z,204,scientificamerican.com,Artificial Sweeteners May Change Our Gut Bacteria in Dangerous Ways
2013-12-29T17:28:43Z,1,programmablegatorade.tumblr.com,Finding a Graph's Radius with an FPGA
2014-10-07T15:05:54.000Z,1,businessweek.com,The Bacon Boom Was Not an Accident
2011-04-29T18:05:05Z,206,mozillalabs.com,ozilla Chromeless 0.2
2011-01-11T23:37:55Z,4,arstechnica.com,Lawyer fears Assange could face death penalty in US
2013-01-22T17:19:15Z,2,greenteapress.com,Complexity science Python programming and the philosophy of science
2012-12-16T09:31:38Z,126,graphics.stanford.edu,Data Visualization CourseWiki  CS 448B
2013-02-14T14:08:10Z,1,rambaudpierre.fr,CommitStrip the blog relating the daily life of web agencies developers
2015-01-19T07:41:26.000Z,2,thetechportal.in,LizardSquad’s DDoS tool falls prey to hack exposes complete customer database
2010-11-17T04:58:18Z,32,informationisbeautiful.net,"Jimmy Wales' ""Appeal"" results in 15x more donation dollars"
2011-03-27T11:57:36Z,1,theaccent.org,SXSW Trade Show displays latest technologies
2014-02-04T20:20:26Z,15,opinionator.blogs.nytimes.com,The Dangers of Certainty: A Lesson From Auschwitz
2015-04-04T13:40:32.000Z,1,blog.separateconcerns.com,Lean tools
